text,start,duration
"so you take the minimum of X,t for t set and that some number like around 100.",2823.45,6.455
"Um, he had- he used the idea which was also another of the hacks that was put into",2829.905,5.525
"the Word2Vec was rather than just treating the whole window the same that you should,",2835.43,5.785
"um, count words that are closer more.",2841.215,2.83
"So, in Word2Vec, they sample closer words more commonly than further away words.",2844.045,5.7
"Um, in his system, you're sort of having to have",2849.745,1.97
a differential count for closer words et cetera.,2851.715,3.21
"And then, um, compared to any of that rather than using counts at all,",2854.925,5.51
he then started using Pearson correlations which,2860.435,3.34
"helped and set they're sometimes negative and he decided that it helped,",2863.775,5.22
"um, if you then got rid of the negative values.",2868.995,3.315
"So, in- in some sense,",2872.31,1.72
"this sounds like a bag of hacks,",2874.03,2.015
"um, but on the other hand,",2876.045,2.414
"he was able to show that, you know,",2878.459,2.096
these transformed counts could actually then give,2880.555,2.965
you very useful word vectors as I'm about to show.,2883.52,3.63
"And- well, we have to realize that actually in slightly different forms,",2887.15,5.97
several of these exact same counts are actually being used in Word2Vec as well.,2893.12,4.045
Do you hear that?,2897.165,3.945
Yeah. Were they [inaudible].,2901.11,5.775
"Yeah. So, so that's an- I'm about to show exactly that.",2906.885,4.38
"Um, that's actually a really interesting little,",2911.265,3.105
"um, bit of the data.",2914.37,1.43
"So, you know, what, um, yeah,",2915.8,3.415
"so the, the thing- if you do that,",2919.215,2.79
you not only get word similarities pretty good.,2922.005,2.91
Let me show you this example which is cleaner.,2924.915,3.445
"Um, so this- the precise idea of",2928.36,4.325
evaluating with analogies was not something that had really been developed.,2932.685,4.705
"So, that was actually something that Marsh Mikolov, um, suggested.",2937.39,4.13
"But actually, um, Doug Rohde made this, um,",2941.52,4.135
"really interesting observation which was- he said, look,",2945.655,5.445
"""Once I do these kind of transformations to",2951.1,3.34
"improve the semantic representation of my word vectors,",2954.44,3.485
look this really interesting property emerges.,2957.925,3.78
"Um, that what you find is that there is semantic vectors",2961.705,5.535
are which basically linear components in my carefully-constructed space.,2967.24,5.63
"So, here we have the sort of, um,",2972.87,2.3
"verb to the doer of the verb direction,",2975.17,2.885
"drive, driver, um, clean,",2978.055,2.685
"janitor, swim, swimmer, learn,",2980.74,2.765
"teacher or teach, teacher,",2983.505,2.14
"doctor, treat, priest, pray.",2985.645,3.06
"I mean, you know, it's not exactly perfect,",2988.705,2.295
"you know, there's a little bit of wiggle there, right?",2991.0,1.91
"But, you know, roughly it's completely clear that there's sort of a direction",2992.91,4.83
in the space that corresponds to- from a verb to the doers of a verb.,2997.74,5.58
"Um, and yeah, so he [inaudible] - he-",3003.32,3.11
no one had thought of this idea of doing the analogies and tests.,3006.43,4.02
"But the thing in retrospect that's obvious is,",3010.45,4.445
"if you can construct a vector space that has this linearity property,",3014.895,5.3
then you're definitely gonna do well in analogy.,3020.195,3.545
"So, effectively he had invented a vector space that do",3023.74,2.87
well in analogies because this means that you've got,3026.61,3.245
this direction which is the doer and then you can immediately,3029.855,3.99
say that's the doer vector which you can get from subtracting clean from swimmer.,3033.845,4.31
"And the- Right. So, it's clean from janitor.",3038.155,2.59
And then we can add it on to swim and we'll get somewhere close to swimmer.,3040.745,4.64
"Um, so his space actually did do that.",3045.385,3.025
"And so, um, this is- so the,",3048.41,3.52
"the moral in some sense is,",3051.93,1.775
"if you have- if you kind of do carefully control accounts and so on,",3053.705,4.84
"that conventional methods can also give you good word vector spaces and- I mean,",3058.545,6.17
so that was actually the starting off point for our work on GloVe.,3064.715,4.395
"Um, so that essentially,",3069.11,1.9
there had been these two schools of work.,3071.01,2.43
"Um, there had been the school of work that had",3073.44,3.335
"been explored more in COG psych than anywhere else,",3076.775,3.385
which had been based on counting and transforming counts.,3080.16,3.71
"And, you know, it had some advantages or it seemed it had some advantages, right?",3083.87,5.925
"That, um, you're making sort of efficient use of statistics as you're using",3089.795,3.875
the global statistics of the whole matrix directly to estimate things.,3093.67,4.375
"Um, and at that poi- up until then,",3098.045,3.265
"it had really only being used to capture word similarity, um,",3101.31,4.265
and a lot of it had suffered from disproportionate im- importance given to large counts.,3105.575,6.1
"But Doug Rohde, he had sort of started to show how to solve both of these problems.",3111.675,4.535
"And so on the other hand,",3116.21,1.49
there had been these neural network methods,3117.7,2.06
which are kind of direct prediction methods that,3119.76,2.385
we're defining that probability distribution and trying to predict the words that occur.,3122.145,4.965
"And they had some advantages, right?",3127.11,2.86
The fact that your sampling means that you're not going to run out of memory hopefully.,3129.97,5.06
"I know we've had some memory problems with homework one, but in principle,",3135.03,3.395
you're not as bad memory position and if you have to,3138.425,3.035
"construct a huge matrix because you're going linearly,",3141.46,3.23
"um, but, you know, since you're doing it sample by",3144.69,2.67
"sample it's inefficient use of statistics, um.",3147.36,3.98
"Okay. And so, but on the other hand Mikolov's work it performed perfectly.",3151.34,5.915
"Not perfectly, but really well.",3157.255,1.89
"Um, so this is sort of led into this work,",3159.145,3.735
"um, that Jeffrey Pennington, um,",3162.88,2.46
Richard Socher [inaudible] can we sort of combine these ideas,3165.34,4.815
"and sort of have some of the goodness of the neural net methods,",3170.155,5.29
"um, while trying to do things with some kind of count matrix.",3175.445,5.09
"And so in particular, um,",3180.535,2.115
we wanted to get the result in,3182.65,1.83
a slightly less hacky way that you want to have components of meaning,3184.48,5.76
being linear ope- linear operations in,3190.24,3.3
the vector space that they're just some effective or adding or something like this.,3193.54,4.545
And so the crucial observation of this model was that we could use,3198.085,4.455
ratios of co-occurrence probabilities to encode meaning components.,3202.54,5.145
"And so the idea here is,",3207.685,1.635
if you have a word like ice and,3209.32,2.7
"you say how often the thing's going to co-occur with that,",3212.02,3.195
well solid should co-occur a lot and gas shouldn't.,3215.215,3.75
But well water is also going to co-occur a lot and some random word won't occur much.,3218.965,6.58
"If you have, oops.",3225.545,3.98
"If you have steam,",3229.525,2.295
"you get the opposite pattern with solid and gas, right?",3231.82,4.41
"But so the thing to notice is,",3236.23,2.605
it's not enough to just have large by itself because large,3238.835,3.485
"appears both here and here or small appears there and there,",3242.32,4.0
the thing that's interesting and sort of the difference between,3246.32,3.17
these components in there indicating a meaning component.,3249.49,3.435
And so we can get it that if we look at the ratio of co-occurrence probabilities.,3252.925,7.35
And so for the ratio of co-occurrence probabilities this is a dimension of,3260.275,5.535
meaning and where for other words and this sort of ratio cancels out to about one.,3265.81,7.39
And so in this slide I've moved so it's not how my,3273.2,3.77
small and large that these are actually actual counts from a corpus.,3276.97,3.87
So we roughly get dimension of meaning between,3280.84,2.82
solid and gas are the ones coming out,3283.66,2.58
as about one because they are not the dimension of meaning.,3286.24,3.3
"And so, it seems like what we want is we want to have ratio of",3289.54,4.42
co-occurrence probabilities become linear and our space.,3293.96,4.7
And then we're in a good business.,3298.66,1.855
And so that's what we want to set about doing.,3300.515,2.825
"Well, how can you do that?",3303.34,2.07
"Well, the way you can do that,",3305.41,1.95
"is by if you can make the dot products equal to the log of the co-occurrence probability,",3307.36,8.415
then immediately you get the fact that when you have,3315.775,3.675
a vector difference it turns into a ratio of the co-occurrence probabilities.,3319.45,7.155
"And so, essentially the whole of the model is that we",3326.605,4.035
want to have dot products or logs of co-occurrence probabilities.,3330.64,3.99
"And so, that's what we do.",3334.63,2.31
"So, here is our objective function here",3336.94,2.76
and it's made to look a little bit more complicated.,3339.7,3.625
But essentially we've got this squared loss here,3343.325,3.77
and then we wanting to say the dot-product should be as similar,3347.095,4.725
as possible to the log of,3351.82,2.16
co-occurrence probability and so you'll they'll,3353.98,3.21
"be lost to the extent that they're not the same,",3357.19,3.555
but we kind of complexify it a little by putting in bias terms for both of the two words.,3360.745,6.435
Because maybe the word is just overall common and likes to,3367.18,3.0
co-occur things or uncommon or does end.,3370.18,3.48
And then we do one more little trick because every [inaudible] does tricks to make the performance,3373.66,4.5
"better is that we also use this f-function in front,",3378.16,5.025
so that we're sort of capping the effect that,3383.185,2.325
very common word pairs can have on the performance of the system.,3385.51,4.86
Okay. And so that gave us the GloVe model of word vectors.,3390.37,4.785
"And theoretically, the interest of this was,",3395.155,5.01
"you know, a lot of the preceding literature had been there had",3400.165,3.075
been these count methods and there had been these prediction methods.,3403.24,3.275
And the hope was that this could sort of unify the,3406.515,3.385
two by showing you how you could have a method that,3409.9,3.345
is estimated simply of a count matrix but it's done in the same kind of,3413.245,5.43
iterative loss based estimation method that's,3418.675,2.835
used for the neural methods to get good word vectors.,3421.51,3.45
And this also worked to give good word vectors.,3424.96,2.43
So here's GloVe results for the word frog.,3427.39,3.1
And frogs and toad are obvious.,3430.49,3.495
"But there are these different kinds of words, uh,",3433.985,2.69
various kinds of pretty tree frogs and things like that.,3436.675,4.53
"Okay. Um, so I'll then go from here and say a little",3441.205,5.235
bit more about some of the work on evaluating word vectors.,3446.44,4.74
And this is maybe also a chance just talk a little bit about evaluation altogether.,3451.18,5.325
"So, normally in NLP when we do a valuation,",3456.505,3.66
the first thing that comes up is intrinsic versus extrinsic evaluation.,3460.165,5.155
"So, normally if there's something we trying to do like model, um,",3465.32,4.85
"word similarity with word vectors or we're trying to, um,",3470.17,4.62
"put parts of speech on words or something,",3474.79,3.099
we can just have an intrinsic evaluation of saying how good a job did you get.,3477.889,4.971
Are you guessing the right part of speech?,3482.86,2.245
Are you putting synonyms close together?,3485.105,2.375
And that's sort of normally very easy to do and fast to compute.,3487.48,4.785
And it's useful to do because it helps us understand the system.,3492.265,4.32
"On the other hand, a lot of the time those intrinsic evaluations,",3496.585,3.855
it's not very clear where- where they're having done well on that task is really going to,3500.44,5.845
help us build the amazing natural language understanding robots,3506.285,4.175
that we so ardently desire.,3510.46,1.77
"Um, so, people are also very interested in extrinsic evaluations.",3512.23,5.43
And so extrinsically is then saying well suppose you use,3517.66,3.81
this new stuff in a real system doesn't make performance go up.,3521.47,5.985
And it's then sort of definitional what counts,3527.455,2.745
to you as a real system that normally that's,3530.2,2.635
meaning it's some application that human beings actually care about and liked to use.,3532.835,5.84
"So that's something like web search, or question answering,",3538.675,4.305
"or phone dialog system or something like that, um,",3542.98,4.05
hat you can put it into that system and the numbers get- go up.,3547.03,4.105
"So, that seems what you want to do.",3551.135,2.165
You want to have stuff that works in real tasks.,3553.3,2.275
"Of course, there are sort of on the other hand a lot of things are a lot harder than.",3555.575,4.925
So much more work to do such an evaluation and run different variance of a system.,3560.5,6.84
"And even when the results, uh,",3567.34,3.24
poor or great sometimes it's hard to diagnose.,3570.58,4.02
"You know, if- if your great new word vectors don't work better in the system, you know,",3574.6,4.495
it might be for sort of some extraneous reason about,3579.095,2.705
how the system was built at sort of hiding all your magic.,3581.8,3.025
And if you just change the rest of the system and suddenly show its good effects.,3584.825,4.475
"So, it's kind of hard to do,",3589.3,1.83
"um, sort of, um,",3591.13,1.905
apportionment of goodness and badness Okay.,3593.035,5.025
"So, um, so, today I'm mainly going to say a little bit more about",3598.06,3.72
these intrinsic word vector evaluations that we've talked about.,3601.78,4.2
So we've talked quite a bit about these analogies.,3605.98,3.855
"So if we're actually working out the analogies,",3609.835,2.535
it turns out that normally what people are doing is working out,3612.37,3.84
"a cosine distance and angle between, um,",3616.21,4.68
"different word candidates, um,",3620.89,2.85
to work out which is the word that solves the analogy which,3623.74,3.21
is an Norbert little tiny wrinkle of difference there.,3626.95,3.615
And there's also one other trick that people commonly use.,3630.565,3.435
They forbid the system from returning one of the three word she put,3634.0,3.62
into the analogy Okay.,3637.62,4.0
"But nevertheless, so, this is something that you can evaluate.",3641.62,3.645
Here now some GloVe visualizations.,3645.265,3.255
And so these GloVe visualizations show exactly the same kind of,3648.52,3.72
linearity property that Doug Rohde discovered which means that analogy's work.,3652.24,5.73
"Sort of by construction,",3657.97,1.289
because our vector space wanted to make meaning components linear.,3659.259,4.036
"So, this is then, um,",3663.295,1.98
showing a gender display.,3665.275,3.15
"This is showing one between companies and their CEOs, kind of cool.",3668.425,5.025
And you can also do more syntactic facts.,3673.45,2.7
"So this is showing, um,",3676.15,1.62
positive comparative and superlative of adjectives.,3677.77,3.67
"Yeah. So, Tomas Mikolov came up with this idea of doing these analogy tasks.",3681.44,7.205
And so he built a data-set with a lot of analogies in it.,3688.645,4.17
It's sort of- it's a bit of a weirdo data-set because it's sort of tests a few,3692.815,4.515
"random different things which may have been things that his system worked well on, um,",3697.33,5.05
"but you know, it tests countries and capitals,",3702.38,3.805
"country, cities and states, countries and currency.",3706.185,6.595
So there are a bunch of semantic things that tests.,3712.78,2.755
"And then there are some, um,",3715.535,3.095
"syntactic things that tests so bad, worst,",3718.63,2.73
fast fastest for superlatives.,3721.36,3.175
"But, you know, even some of the ones I was showing before, you know,",3724.535,3.245
there's no- there's no Obama is to,3727.78,2.43
Clinton kind of ones that are actually in this evaluation set.,3730.21,5.19
"Um, here's a big table of results,",3735.4,3.179
"um, that comes from our GloVe paper.",3738.579,2.251
So not surprisingly the GloVe paper perform best in this evaluation.,3740.83,4.44
"Because that was our paper. Um, [LAUGHTER]",3745.27,2.88
"[LAUGHTER] But I mean perhaps- you know,",3748.15,3.3
"perhaps the things to start to notice is,",3751.45,2.73
"yeah, if you just do a plain SVD on counts.",3754.18,3.48
"You know that that works abominably badly for these, um, analogy tasks.",3757.66,6.51
"But, you know, kind of as Doug Rohde showed,",3764.17,2.655
"if you start then doing manipulations of the count matrix before you do an SVD,",3766.825,7.05
you can actually start to produce,3773.875,1.815
an SVD based system that actually performs quite well on these tasks.,3775.69,5.4
"Um, you know, not badly against other things.",3781.09,4.32
"Um, other things that you will discover,",3785.41,2.58
"right at the top there are a 100 dimensional ones,",3787.99,2.49
"and at the bottom there are some 1000 dimensional ones,",3790.48,2.88
and other 300 dimensional ones.,3793.36,1.995
"At least when you're training on a big amount of text,",3795.355,2.37
bigger dimensionality definitely works better.,3797.725,2.805
And I'll come back to that in a minute.,3800.53,1.89
"Um, the amount of text makes a difference as well, right?",3802.42,3.21
"So we're going up from- so one to 1.5 billion words at the beginning,",3805.63,4.89
"to these ones down here are being trained over 42 billion words of text,",3810.52,3.96
"and perhaps unsurprisingly, the 42 billion words of texts ones work better.",3814.48,5.97
"Um, so it's big data.",3820.45,2.21
"Um, here are a couple more steps from this paper.",3822.66,2.865
So this is a graph of dimensionality and what the performance is.,3825.525,4.575
"So for the three lines the green one's semantic,",3830.1,2.879
the blue one's the syntactic analogies and so red's the overall score.,3832.979,4.736
So sort of what you see is up to dimensionality,3837.715,3.075
"300 things that clearly increasing quite a bit,",3840.79,3.585
"and then it gets fairly flat,",3844.375,1.71
"which is precisely why you find a lot of word vectors,",3846.085,3.24
"um, that are of dimensionality 300.",3849.325,2.445
"Um, this one's showing what window size.",3851.77,3.735
"So this is sort of what we talked about symmetric on both sides window size,",3855.505,5.175
and as it goes from 246810.,3860.68,2.775
"And sort of what you see is,",3863.455,1.785
"if you use a very small window like two, that actually works.",3865.24,4.395
"That the, the syntactic prediction is stronger because well,",3869.635,3.975
syntactic effects are very local.,3873.61,2.16
"Whereas as you go out,",3875.77,1.575
the semantic prediction gets better and better.,3877.345,2.46
"Actually this syntactic gets a bit better as well,",3879.805,2.565
but it's especially the semantic that gains.,3882.37,2.73
"Um, the right graph shows that if you only use context on one side,",3885.1,4.98
"um, your numbers aren't as good.",3890.08,2.49
"Okay, um, so, I sort of just wanted to sort of sneak in a little cameos of a couple of,",3892.57,8.13
"um, recent bits of work,",3900.7,2.34
"as sort of a first of what things people are doing,",3903.04,2.775
"um, with word vectors.",3905.815,1.755
"Um, so this one, um,",3907.57,2.1
was actually by two Stanford people.,3909.67,2.805
"Um, now the best- this would be the best story.",3912.475,2.535
"If I could say that this was a final project,",3915.01,2.985
"um, in this class last year,",3917.995,1.545
but unfortunately that's not true.,3919.54,1.485
This paper has nothing to do with this class [LAUGHTER].,3921.025,4.305
But it-- right.,3925.33,1.38
"Um, Zin Yin and Yuanyuan,",3926.71,3.78
"um, actually had, um,",3930.49,3.42
"some sort of clever and very mathy ideas,",3933.91,3.78
where they're using matrix perturbation theory.,3937.69,3.51
"Um, and sort of just showing how, um,",3941.2,2.94
dimensionality in word vectors actually sort of feeds into the bias-variance trade-off.,3944.14,4.89
"If you've seen that,",3949.03,1.305
"um, in other parts of machine learning.",3950.335,2.49
And I'm not even going to attempt to explain their paper.,3952.825,3.36
"Um, but here it is,",3956.185,1.35
"that they did really well with this paper,",3957.535,1.695
they gone all talk in Europe's from it.,3959.23,2.34
"Um, and so- but there's sort of",3961.57,2.01
"an interesting result of what you see with these word vectors,",3963.58,4.14
which is in a way kind of surprising.,3967.72,2.295
"So this is showing doing word vector dimensions from zero up to 10,000.",3970.015,6.195
So we're going way higher than we talked about before.,3976.21,3.06
"And so what you discover which people have known for ages is,",3979.27,4.17
"that there's sort of a little blip that somewhere around two or 300,",3983.44,4.305
which seems to optimize performance.,3987.745,2.49
"So, I've used those sizes.",3990.235,2.04
"But the thing that they were sort of doing a lot of their theory about,",3992.275,3.645
"and it's kind of surprising is, well,",3995.92,2.265
"surely if you have a humongous humongous number, like,",3998.185,4.065
"if you are using 10,000,",4002.25,2.04
"um, dimensional vectors, you know,",4004.29,2.43
"you're trying to estimate another two orders of magnitude more numbers for every word,",4006.72,6.6
"surely things should just fall apart, um,",4013.32,3.135
because you've got hopelessly many parameters relative to,4016.455,3.465
the amount of training data that you're trying to estimate these numbers from.,4019.92,4.14
"And so the interesting result that they show is,",4024.06,3.27
that things don't fall apart.,4027.33,2.94
"Um, and that you can essentially go out to these huge huge dimensionalities,",4030.27,5.01
and the performance stays flat.,4035.28,2.085
"And that they've got a lot of theory,",4037.365,1.92
sort of for predicting why that that's actually going to end up being the case.,4039.285,5.385
"Um, yeah.",4044.67,2.115
"So for training these models iteratively,",4046.785,2.19
"this is- orange is showing, um, GloVe training.",4048.975,4.8
"You know, they keep on getting better for a while.",4053.775,2.595
"So you know, just go out,",4056.37,1.5
"go sleep and see in the morning how it's doing, right?",4057.87,3.15
"So that if you were running it, um,",4061.02,1.53
for 24 hours your numbers are better than if you only ran it for six hours.,4062.55,4.74
"Um, and that's true for a lot of deep learning models, sorry.",4067.29,4.32
So this is the key reason why you don't want,4071.61,3.12
to start your assignment the night before it's due.,4074.73,3.18
"Because even if you program it perfectly,",4077.91,2.97
"you might just not have enough time for it to run,",4080.88,2.985
"um, so that you produce good numbers at the end of it.",4083.865,3.565
"Um, okay. Uh, yeah so,",4088.16,4.12
"so couple of more, um,",4092.28,2.685
"things, on that, um.",4094.965,2.745
"Yes. So, um, what are we showing here?",4097.71,4.14
So these are again semantics in tactic and overall numbers.,4101.85,4.335
So there are sort of two things that are sort of being mixed together here.,4106.185,3.765
"One is, if we just look at the overall numbers,",4109.95,3.06
"they're highest over here, um,",4113.01,2.085
"which is this 42 billion Common Crawl web-pages corpus,",4115.095,4.635
that gives us the highest overall number.,4119.73,2.355
"But there's sort of something else that's interesting in this graph, which is,",4122.085,4.65
"um, that using Wikipedia works frequently well.",4126.735,4.995
So that you actually find that 1.6 billion tokens of Wikipedia works,4131.73,5.31
better than 4.3 billion tokens of News-wire newspaper article data.,4137.04,6.6
"And so I, I think that's sort of actually make sense,",4143.64,4.485
"which is well, you know,",4148.125,1.155
the job of encyclopedias is to just sort of,4149.28,2.34
"explain concepts and how they relate to each other, right?",4151.62,3.24
So that encyclopedias are,4154.86,2.01
"just much more expository text that show all the connections between things,",4156.87,5.13
whereas newspapers in general aren't trying to expose at how things fit together.,4162.0,5.73
"They're just telling you about, you know,",4167.73,1.8
"who got shot dead last night or something like that, right?",4169.53,3.45
"So, um, so this is sort of interesting fact, um,",4172.98,4.62
"that this Wikipedia data kind of really,",4177.6,2.355
"it sort of is differentially useful, um,",4179.955,2.7
"for, um, making word vectors.",4182.655,3.525
"And you know, in fact, you know,",4186.18,2.205
when we did very well without GloVe word vectors and lots of people use those.,4188.385,5.55
"You know, I think actually one of the reasons why they work so well is that",4193.935,4.125
"the original word2vec vectors that Google distributes are built only on Google News data,",4198.06,5.82
"where else sort of have this,",4203.88,1.89
"um, Wikipedia data inside them.",4205.77,2.145
"Okay, um, rushing ahead.",4207.915,3.735
"Um, yes, so the- there's all the work on analogy,",4211.65,2.85
but the other more basic evaluation is this one of capturing similarity judgments.,4214.5,5.88
"And I haven't said much about this, but you know,",4220.38,2.64
"there is this sort of large sub-literature in the psychology community,",4223.02,5.115
where people have wanted to model humans judgments of similarity.,4228.135,4.8
"So like a good psych person, what you do,",4232.935,3.33
