text,start,duration
a mini-batch of 64 examples or something like that.,1418.96,3.315
"Um, and you don't have to but you know,",1422.275,2.235
"it turns out the details of the guts of the hardware that you know,",1424.51,3.27
"it isn't- [inaudible] GPUs, you know, they have these,",1427.78,2.82
"whatever they have inside them,",1430.6,1.44
there in powers of two.,1432.04,1.455
"So, you get better speedups if you use batches like 32 or 64,",1433.495,4.47
rather than just deciding that 42 is still your favorite number from,1437.965,3.105
high school [LAUGHTER] and you're going to use that as the size of your mini-batch.,1441.07,4.99
"Okay. um, yeah here's",1447.0,3.61
one other interesting thing which,1450.61,3.12
"actually has some optimization details in it, it turns out.",1453.73,3.54
"Um, if you think of these um,",1457.27,2.355
"doing stochastic gradients with word vectors,",1459.625,3.33
that's actually very different to,1462.955,1.545
some other deep learning problems like vision deep learning problems.,1464.5,3.885
"Because for either a single window or even a sort of a reasonably sized mini-batch,",1468.385,5.355
"it will turn out that those mini-batch,",1473.74,2.835
"mini-batch only has, you know,",1476.575,2.685
"relatively speaking a handful of words in it, right?",1479.26,2.73
"So, if you have mini-batch of size 32 and a window size of ten,",1481.99,3.72
"you know, probably there are only about a 100,150 different words in it.",1485.71,4.29
"Um, but yet we're building this model over",1490.0,3.03
a vocabulary of quarter of a million words or something like that.,1493.03,3.105
"So, just about all of the elements in this vector are zero.",1496.135,4.155
"Um, and so, um,",1500.29,3.15
"we sort of really have this very sparse um,",1503.44,3.495
"perimeter update and so, um,",1506.935,3.63
"that sort of suggests that we actually probably um,",1510.565,3.735
want to sort of only update the word vectors that,1514.3,3.48
"appear and then the question is whether you can achieve that, right?",1517.78,3.6
"The dumb way to do it, is you just have this matrix that's normally,",1521.38,3.66
nearly all zeros and you say add,1525.04,2.79
"those two matrices together and there you go and then the question is,",1527.83,5.4
can you actually have a sparse matrix update which only updates,1533.23,4.8
the certain rows of the matrix that contain,1538.03,3.0
the words that you've entered and do things much faster?,1541.03,3.615
And if you're doing something even cleverer like doing,1544.645,2.595
"distributed computation over multiple computers and sharing your parameters,",1547.24,4.98
well then definitely you just sort of only want to update,1552.22,2.4
the word vectors that you've actually been getting a parameter estimate for.,1554.62,4.04
"So, there's sort of some details there but I'm",1558.66,2.19
"going to skip past them for more details, um.",1560.85,3.14
"Right. So, a couple of people asked afterwards, yeah,",1563.99,4.58
why are there these two word vectors that sort of center and the outside one?,1568.57,5.955
"And, I mean the answer to that is,",1574.525,2.145
"it makes that math I showed you easy, right?",1576.67,2.85
"So that if, um,",1579.52,2.355
"if you do it as I showed you, well,",1581.875,3.57
"you know, for working out, um,",1585.445,2.685
the partial derivatives for the center word.,1588.13,3.855
"It's just as I showed you, it's easy.",1591.985,3.225
"Um, but if you use only one set of word vectors,",1595.21,4.77
"well then the same word,",1599.98,1.83
"that's the center word,",1601.81,1.425
will be one of the choices for,1603.235,2.205
the context word when you're working out that Softmax for the context word.,1605.44,4.455
And then you'll get these terms that are then,1609.895,2.655
"squared terms in terms of the two references,",1612.55,3.27
"so that same word,",1615.82,1.47
and that makes your math more difficult.,1617.29,2.64
"Um, so it's sort of just a practical thing,",1619.93,3.795
"um, in the end.",1623.725,1.65
"I mean it sort of doesn't make very much difference,",1625.375,3.225
"because if you sort of think about it since you're going along through all the,",1628.6,3.405
"um, positions, you know.",1632.005,1.62
What was a center word at one point is immediately afterwards,1633.625,3.375
"a context word of what used to be a context word,",1637.0,3.51
which is now the center word.,1640.51,1.38
"So, sort of doing the same computations because, you know,",1641.89,4.35
"the dot product is symmetric actually,",1646.24,2.264
"um, all over again.",1648.504,2.266
"So, they get pretty similar vector representations.",1650.77,3.33
"So, it seems like in general you can get the best results",1654.1,2.43
"by averaging what comes out for your two vectors,",1656.53,2.819
and you end up with just one vector per word.,1659.349,2.641
"Okay, more substantively, um,",1661.99,3.75
"if you go to the word2vec paper,",1665.74,2.88
you'll discover that there's sort of more to word2vec that they,1668.62,3.3
define as sort of a family of word2vec models.,1671.92,3.645
And there are so two main parts of that family.,1675.565,3.48
"Um, firstly, there's a choice between the Continuous Bag of Words model,",1679.045,4.41
and the skip-grams model.,1683.455,1.89
And what I presented with the skip-grams models.,1685.345,2.595
"So, in the skip-grams model,",1687.94,1.71
you've got one center word and you're trying to,1689.65,2.52
predict all the words in context one at a time.,1692.17,3.345
For the Continuous Bag of Words model it's the opposite.,1695.515,3.71
"You've got all of the outside words and you're trying to use all of them,",1699.225,4.755
though considered independently like a Naive Bayes model to predict the center word.,1703.98,5.735
"Um, and then the second one is, um,",1709.715,4.61
the way I presented learning this was,1714.325,3.36
the method that's using the so called Naive Softmax.,1717.685,3.555
"So, therefore when we are wanting to work things out,",1721.24,3.075
"we were sort of saying okay we want probability estimates for the context words,",1724.315,5.039
and so we're just going to sum over,1729.354,1.636
the whole vocabulary and we'll come up with these probability estimates.,1730.99,4.56
"Um, in practice, that turns out to be a sort of",1735.55,3.99
a bad idea because that would also make things mega slow.,1739.54,4.32
"So, in homework two,",1743.86,2.024
"coming up next week, um,",1745.884,2.116
"you will get to implement a much more practical, um,",1748.0,3.585
"way of doing this which they present in the word2vec papers, right?",1751.585,3.945
"So, the problem is,",1755.53,1.2
"if we're using this equation that we use to do the calculus,",1756.73,4.305
"that down in this denominator here,",1761.035,2.19
we're doing the sum over the entire vocabulary.,1763.225,3.195
"So, if you have a vocabulary of a quarter million words,",1766.42,2.7
we're sort of doing a quarter of a million dot products and,1769.12,2.49
exponentials and adding them all to work out that denominator.,1771.61,4.56
"And that sort of seems uh,",1776.17,2.01
sort of a really bad idea if you want things to be fast.,1778.18,3.06
"Um, so, um, Tomas Mikolov and",1781.24,3.12
colleagues came up with this idea of negative sampling would be near enough.,1784.36,4.47
"And so the idea of negative sampling,",1788.83,2.205
is we're going to train binary logistic regressions instead.,1791.035,4.71
"And so, we're going to train one binary logistic regression",1795.745,3.78
"for the actual word observed what's in the numerator,",1799.525,4.53
and you want to give high probability to the word that was actually observed.,1804.055,5.085
"And then, what we're going to do,",1809.14,2.685
"is we're going to sort of randomly sample a bunch of other words,",1811.825,3.855
they're the negative samples and say they weren't the ones that were actually seen.,1815.68,6.24
"So, you should be trying to give them as low a probability as possible.",1821.92,4.875
"Okay, so, um, the sort of notation that",1826.795,4.125
they use in the paper is sort of slightly different to the one I've used.,1830.92,4.275
"They actually do maximization not minimization,",1835.195,3.165
and that's the equation which I'll come back to.,1838.36,4.02
"Um, though before we do that here's the sigmoid function.",1842.38,4.32
"So, the sigmoid function is normally written like this,",1846.7,2.61
one over one plus E to the minus X.,1849.31,2.595
"But, um, essentially,",1851.905,2.325
"the sigmoid function is like a binary case of the Softmax function, right?",1854.23,5.37
"That we have two possible outcomes, yes or no,",1859.6,3.42
"and that you're sort of again got an input that is any real number,",1863.02,4.59
and it's mapping it onto a probability distribution between,1867.61,3.69
zero and one which represents these two binary outcomes.,1871.3,3.57
"And to the extent that the number is positive,",1874.87,1.92
it kind of ceilings to one and negative goes down to zero.,1876.79,4.425
"Okay, so with this time,",1881.215,1.95
"we're going to take the dot for- for the good word,",1883.165,3.074
"we're going to take the dot product of the two vectors,",1886.239,3.091
shove it through our sigmoid function,1889.33,2.505
"and then we're going to want that probability estimate,",1891.835,2.445
"um, to be as high as possible.",1894.28,2.43
"So, if I show you this version,",1896.71,2.1
"which is just written slightly differently, um,",1898.81,3.03
"to look as much as possible like the notation that we used last time,",1901.84,4.89
here is our new objective function for using negative sampling.,1906.73,3.945
"And we've got two terms,",1910.675,1.74
"the first one, um,",1912.415,2.085
"is the log of the sigmoid of the observed context word,",1914.5,4.785
"the outside words, dot producted with the center word,",1919.285,3.525
and we're going to want that to be big.,1922.81,2.37
"Um, and then on the other hand,",1925.18,3.255
"um, we've got, um, the,",1928.435,4.35
"um, randomly chosen K words,",1932.785,4.065
"which are just other words,",1936.85,1.68
and we're going to work out dot products between them and the center word.,1938.53,3.375
And we're going to want those to be as small as possible.,1941.905,3.195
"Um, note that extra minus sign in there which is causing",1945.1,3.24
"the sign of the two things to be different, right?",1948.34,3.21
"So, those are our negative samples.",1951.55,2.805
"And for big K, it can be a reasonably modest number,",1954.355,2.865
"you can just take kind of 10,",1957.22,1.38
15 negative samples and that works pretty fine.,1958.6,4.065
"Um, I said we sort of sampled some words,",1962.665,4.005
"um, to be the negative samples.",1966.67,2.085
They in particular propose a sampling distribution that helps them along,1968.755,5.505
a little in partly dealing with this pro- problem of very frequent words.,1974.26,6.0
"Um, so the starting point of how you sample words is you",1980.26,3.72
use what we call the- the unigram distribution.,1983.98,3.48
"So, that just means you take words on a large corpus and count up",1987.46,3.93
"how often each one occurs just as a count of independent words,",1991.39,4.62
so there's the called unigram counts.,1996.01,2.115
"And so you start off with unigram counts,",1998.125,2.355
but then you raise them to the three quarters power.,2000.48,3.105
"And raising to the three quarters power,",2003.585,2.145
"has the effect of, um,",2005.73,1.665
"decreasing how often you sample very common words,",2007.395,3.39
and increasing how often you sample rarer words.,2010.785,4.41
"Okay, um, and that's that.",2015.195,4.2
"Okay, so that's everything about word2vec I am going to say.",2019.395,4.56
Anyone have any last thing.,2023.955,4.605
Yes. [NOISE],2028.56,3.685
"Oh, oh [NOISE]. This is a- sorry Z,",2032.245,3.03
"that capital Z is often used as a normalization term and so this is saying,",2035.275,5.385
"well if you want the probability distribution of words,",2040.66,3.045
is you work out this three quarters power of the count,2043.705,3.255
of the word for every word in the vocabulary and then these,2046.96,3.27
numbers you just sum them up over the vocabulary and it'll be sum,2050.23,3.57
total and we're dividing by that so we get a probability distribution.,2053.8,3.87
Good question because i hadn't explained that.,2057.67,2.175
"Um, in this class, when you see the letter Z with no explanation,",2059.845,3.765
it normally means I am a normalization term to turn things into,2063.61,5.13
probabilities and you sort of iterate over,2068.74,2.46
the numerator term and summing them and divide through.,2071.2,3.6
Any other questions of things I haven't explained or otherwise? Yes.,2074.8,5.73
So the window [inaudible] that's a [inaudible],2080.53,4.47
"Yeah, yes.",2085.0,1.29
"So, [NOISE] what size window do you use?",2086.29,2.19
"I'll actually come back to that in a bit and show a little bit of data on that,",2088.48,4.035
"but yeah, we haven't done anything about that.",2092.515,1.965
"At the moment we're guessing a window size like five,",2094.48,2.79
"which isn't a bad one um,",2097.27,1.725
"but you know there isn't- there hasn't really been any science behind that, um,",2098.995,5.31
"that people treat that as what's then called a hyperparameter which means that um,",2104.305,5.1
you try a few different numbers and see which one seems,2109.405,3.315
best and that's the one that you use in your future work. Yeah.,2112.72,4.59
"Um, [inaudible] three quarters power",2117.31,2.175
chosen for any theoretical reason or just because it seems to work in practice?,2119.485,4.695
"Um, no. Um, that,",2124.18,2.88
"that was um, also chosen as a hyperparameter and improved performance.",2127.06,6.06
"I mean, actually um, you know,",2133.12,2.37
"for this Word2Vec paper, I mean,",2135.49,3.09
"you know, it turns out that um,",2138.58,2.415
"in the actual paper um,",2140.995,2.325
the model looks very- fairly clean but what,2143.32,4.17
"people's discovered when they started digging through the code,",2147.49,3.959
"which to- to their credit they did make available, reproducible research,",2151.449,4.876
that there are actually a whole bunch of tricks,2156.325,2.85
"of different things like these hyperparameters of um,",2159.175,4.125
"how you sample, and how you wait windows and various things to make the numbers better.",2163.3,5.175
"So, you know, people play quite a few tricks to make",2168.475,2.715
the numbers go up which aren't particularly theoretical.,2171.19,4.015
Are we good?,2175.205,2.325
Yeah.,2177.53,16.01
[inaudible] [NOISE].,2193.54,5.69
"Ah, sometimes.",2199.23,3.095
"I so- I- you- so in general for a lot of these sampling things,",2202.325,6.185
"it's a bad idea if you're going to be doing multiple passes if you just go bloom,",2208.51,4.635
"bloom, bloom and then bloom, bloom, bloom again,",2213.145,2.385
"that's a bad idea,",2215.53,1.14
but a common technique a lot of the packages use,2216.67,2.91
is that they do use this shuffling operation at the beginning.,2219.58,3.24
"So for each epoch,",2222.82,1.5
they'll shuffle the data randomly and then they'll go through it in sequence and that has,2224.32,4.56
"the benefits of faster computation from locality et cetera um,",2228.88,5.025
"while ha- meaning that when you do it differently epoch,",2233.905,2.685
it will work out differently.,2236.59,2.13
"Uh, yeah, yeah.",2238.72,9.93
[inaudible] [NOISE] [inaudible].,2248.65,0.3
That last question I think was talking about taking the mini-batches from the corpus and,2248.95,5.235
contrasting whether you actually say sample 20,2254.185,2.955
randomly from the whole corpus versus just sort of working from left to right.,2257.14,4.395
"Yes, do you have a question?",2261.535,1.695
"Um, yeah [inaudible] [NOISE].",2263.23,12.54
Yeah. So- so you could argue- you could argue,2275.77,3.42
"whether or not this was written in the clearest way, but, right.",2279.19,3.705
"So, we're making this dot product and then we're negating it",2282.895,4.215
"which is then flipping which side of the space we're on, right?",2287.11,4.4
Because the sigmoid is symmetric around zero.,2291.51,4.38
"So, if we've got some dot product um,",2295.89,3.325
"and then we negate it,",2299.215,1.575
we're sort of working out a one minus probability and so,2300.79,4.305
"that's the way in which we're actually for the first um,",2305.095,5.13
for the first time we're wanting the probability to be,2310.225,2.685
"high and then for the negative samples,",2312.91,2.73
we're wanting their probability to be low.,2315.64,2.88
"Okay, I'll maybe run ahead now.",2318.52,3.975
"Um, so this was an algorithm which um,",2322.495,5.315
sort of you're going through this corpus position by position and you're sort of doing,2327.81,6.06
this prediction of words and then you're,2333.87,2.91
"updating some parameters and you're learning something and you know,",2336.78,3.42
"by job it seemed to work based on what we saw in the examples,",2340.2,4.2
"but you know, you might have thought um,",2344.4,2.755
that that was kind of weird right?,2347.155,1.8
"Look we have this whole big pile of data you know,",2348.955,3.645
"sort of traditional, I'm thinking of statistics, right?",2352.6,3.96
"So you have a big pile of data,",2356.56,1.62
you aggregate it and it sort of seems like there are obvious things you could do here.,2358.18,4.35
"You could say, well there's a word like,",2362.53,2.4
"whatever word we're using, banana.",2364.93,2.1
Let's just see what words occur in the context of the gut banana and count,2367.03,4.11
"them all up and then we'll be able to use those to predict somehow and you know,",2371.14,4.23
those kinds of methods were traditionally,2375.37,3.57
used including even with distributed representation techniques.,2378.94,4.41
"Um, so I want to say a bit about that,",2383.35,1.86
so you're fully educated and don't sound like one of those people who were,2385.21,4.605
aware of no work that happened before 2013 when your network's took off.,2389.815,5.625
"Um, okay. So, what we could do is we can essentially",2395.44,3.87
do the same thing as sort of Word2Vec.,2399.31,3.99
We could say there's a five word window around,2403.3,3.885
"each word instance that's often referred to as a word token, right?",2407.185,3.975
"So at NLP, we often want to distinguish between a particular kind of type like banana",2411.16,6.09
or apple versus particular instances,2417.25,3.15
often in the text and that's referred to as sort of a type token distinction.,2420.4,3.585
"So we could, um,",2423.985,2.175
"look at each um token with a word,",2426.16,3.51
"and the words five around that,",2429.67,1.62
"and then we could so start counting up which words occur,",2431.29,3.39
occur with it and so we can then have a matrix of co-occurrence counts.,2434.68,6.165
"Um, okay.",2440.845,2.085
"So, we'll have again,",2442.93,1.485
and I'm going to give me an example of this.,2444.415,1.665
"So, normally again you use the five to 10 but you know I can just",2446.08,3.27
use a window of one to keep my counts very simple and small.,2449.35,3.705
"I ignore left or right just like Word2Vec did,",2453.055,3.345
"and so if I have a teeny baby corpus like this,",2456.4,3.075
"you know, what I could do,",2459.475,1.365
is just say here is the matrix of word co-occurrence accounts.,2460.84,4.605
"So, within my window size of one,",2465.445,2.85
"I occurs next to like twice,",2468.295,2.565
"and that means that like occurs next I twice it's symmetric,",2470.86,3.63
"and all my other accounts here are singletons, um.",2474.49,4.23
And so this gives me a big huge sparse matrix of word co-occurrence accounts.,2478.72,6.86
"And so one thing that you could do is just use this matrix directly,",2485.58,4.42
because I haven't really got enough data here.,2490.0,2.87
"But, you know, if you sort of,",2492.87,2.31
"um, decided that, you know,",2495.18,2.945
"the word like is like the word learning,",2498.125,2.79
what you'd do is you'd expect that,2500.915,1.845
these two vectors would end up kind of similar to each other.,2502.76,4.12
And [NOISE] they do.,2506.88,1.465
"So, you can just measure, um,",2508.345,1.67
similarity of the vectors directly in terms of these co-occurrence counts.,2510.015,5.565
"But, you know, it's a little bit unappealing doing things this way, right?",2515.58,4.4
If you have a quarter million word vocabulary that's where,2519.98,3.18
"you are in this space where my math is bad,",2523.16,3.385
"but it's in the trillions of the number of cells of this matrix,",2526.545,3.305
might require a lot of storage.,2529.85,2.08
Though if you're clever and notice that most of the cells were zero and could do,2531.93,3.56
some clever sparse matrix representation might take a little bit less.,2535.49,4.55
"Um, your classification models might have sparsity issues cause, you know,",2540.04,3.67
a lot of those cells aren't present and so it might not be very robust.,2543.71,3.75
"And so those are traditional answer to all of these things which is well,",2547.46,4.52
maybe we could have that big co-occurrence counts matrix,2551.98,4.125
"and somehow reduce its dimensionality of just, um,",2556.105,4.825
"find a corresponding low dimensional matrix which preserves,",2560.93,4.615
"uh, most of the information, um,",2565.545,2.37
"in the original matrix and, you know,",2567.915,2.865
"maybe we'll reduce things to a dimensionality of somewhere around the size 25 to a 1,000,",2570.78,5.36
um as is done with Word2Vec.,2576.14,3.055
"So, there's sort of a standard most common way of doing",2579.195,3.425
"this dimensionality reduction and you don't really have to understand all the math,",2582.62,4.59
"but you get to play with this and homework one which is, um,",2587.21,3.505
"for any matrix you can do what's called the singular value decomposition, um,",2590.715,4.95
"which is a way you can take an arbitrary matrix and decompose it into three matrices, um,",2595.665,7.84
where the center one is diagonal and has what- in it what are,2603.505,3.745
called singular vectors which are weightings of the different dimensions.,2607.25,4.07
"So, they decrease in size as you go downwards.",2611.32,3.575
And then these two U and V are then,2614.895,2.645
orthogonal bases corresponding to the rows and columns.,2617.54,4.405
"And so in particular,",2621.945,1.49
"it's even simpler than the case where we just have these word-word vectors,",2623.435,3.88
because you have a square matrix and so they are effectively the same.,2627.315,3.78
"But, you know, for the general case, um,",2631.095,2.395
"although you get these sort of full orthogonal bases,",2633.49,3.599
you then have these bits sort of don't really,2637.089,2.976
matter cause they end up being used for nothing when you work out the product.,2640.065,3.79
"Um, and then if you want to reduce the dimensionality, what you say is,",2643.855,5.325
throw away the smallest singular values which remember there are in decreasing,2649.18,5.495
size and that means you're then effectively,2654.675,3.065
throwing away rows and columns of these other matrices.,2657.74,4.3
"And then it says,",2662.04,1.1
behold I've now reduced these things to,2663.14,2.72
a two-dimensional representation from,2665.86,2.5
the original three-dimensional representation and that's referred to as,2668.36,4.08
the reduced SVD and the classic result is in terms of least squares error in,2672.44,6.835
"estimation that this- the product of these three things will give X k which is the best,",2679.275,7.914
"um, k- rank k approximation to the original X in terms of,",2687.189,5.021
"uh, X squared least squares criterion.",2692.21,2.945
"So, we could do this and we could build word vectors.",2695.155,3.82
"So, I can, um,",2698.975,1.775
"make use of, um,",2700.75,1.695
"NumPy's SVD function and I can throw into it,",2702.445,4.73
"um, matrices and, um,",2707.175,4.35
I can make word vectors.,2711.525,2.515
"And these ones look really bad, but hey,",2714.04,2.135
I give it a dataset of three centers [LAUGHTER] and it's not exactly a fair comparison.,2716.175,4.65
"But- so this technique was in, um,",2720.825,2.595
"popularized around, um, the turn- the turn of the millennium.",2723.42,5.505
"It generally, um, went for",2728.925,2.065
some word applications under the name of latent semantic analysis or,2730.99,3.91
latent semantic indexing and the idea was that you could have,2734.9,3.685
these semantic directions that you are,2738.585,2.905
finding in this low dimensional space that had meaning.,2741.49,3.12
And people worked with it quite a bit for techniques,2744.61,2.77
like t- trying to do information retrieval,2747.38,3.06
using these LSA approximations and it sort of worked a bit.,2750.44,6.505
"It kind of never really worked very well I think,",2756.945,5.195
"um, and so it never sort of hugely caught on.",2762.14,4.425
"Um, but it's- the methods kind of continued to be explored actually mainly in the sort of",2766.565,5.205
COG psych- COGS psych community where people were doing things with word meaning.,2771.77,5.365
"And there's this sort of kind of interesting, um,",2777.135,3.005
"the [NOISE] to the literature that there was this guy Doug Rohde, um,",2780.14,4.815
"who, um, did a PhD at CMU, um, in 2005.",2784.955,6.1
"And basically what he discovered was,",2791.055,3.17
"look if rather than just using raw counts,",2794.225,3.49
"I start doing quite a bit more in terms of,",2797.715,4.46
"you know, fiddling with the counts,",2802.175,2.39
I can start to produce results that are much better.,2804.565,2.96
"So, rather than using low counts,",2807.525,2.095
you have to do something to deal with those very high-frequency words.,2809.62,3.83
"So, one idea is you could log scale them which",2813.45,2.51
is also commonly used in information retrieval.,2815.96,2.545
"Another idea is you could just use something like,",2818.505,3.07
"uh, a ceiling function,",2821.575,1.875
