text,start,duration
"And they further
elucidated the motifs",4496.29,2.59
"that were being interacted with
and the little arrows point",4498.88,4.36
"to where the mutations
in those motifs occur.",4503.24,4.44
"So they've gone
from an association",4507.68,2.5
"with that particular disease
to the actual functional",4510.18,6.36
"characterization
of what's going on.",4516.54,3.22
"I'll leave you with a final
thought to think about.",4519.76,2.62
"This is the thing
that caused the brawls",4522.38,3.207
"in the bars I told you about
at the beginning of today's",4525.587,2.333
lecture.,4527.92,1.78
"Let's suppose you look
at identical twins,",4529.7,2.22
"monozygotic twins, and you
ask the following question.",4531.92,2.35
"You say, OK, in
monozygotic twins,",4534.27,2.78
"the prevalence of a particular
disease is a 30% correlative.",4537.05,6.13
"That is, if one individual
in a twin has the disease,",4543.18,3.68
"there's a 30% chance that the
other twin's going to get it.",4546.86,4.44
"Now there are two
possibilities here,",4551.3,1.64
"which is that for
all pairs of twins,",4552.94,3.564
"there's a very low risk
that you're going to get it,",4556.504,2.166
"or that there are some
subset of genotypes where",4558.67,4.48
"if one twin has it, the other
one's always going to get it.",4563.15,4.03
"So the author of the
study actually looked",4567.18,3.14
"at a block of identical twin
data and asked two questions.",4570.32,2.79
"The first was if you look at
the percentage of cases that",4573.11,4.85
"would test positive, making
no assumptions about genotype,",4577.96,5.06
"using twin data, you
can see the percentage",4583.02,2.909
"of people that actually
have a disease that",4585.929,1.791
"will test positive
is actually fairly",4587.72,2.28
"low for a wide
variety of diseases.",4590.0,2.32
"All these diseases were
studied in the context",4592.32,2.89
of identical twins.,4595.21,3.2
"And this suggested to
them that, in fact,",4598.41,5.15
"personal genomic
sequencing might not",4603.56,2.94
"be as predictive
as one might like.",4606.5,4.04
"That is, if you have a disease,
for over half of these,",4610.54,4.15
the test will not be positive.,4614.69,3.57
"And furthermore, if you test
negative for the disease,",4618.26,3.91
"your relative risk--
that is, the chance",4622.17,1.82
"you're going to get this
disease to the chance you get it",4623.99,2.6
"at random in the population--
is not really reduced that much.",4626.59,5.36
"And so, since this study
relied solely on twin data",4631.95,4.01
"and didn't make any
other assumptions,",4635.96,2.19
"it raised the question in
the field of to what extent",4638.15,4.46
"is personal genome sequencing
going to be really helpful?",4642.61,3.46
"So on that note, we've
talked a lot today",4646.07,2.34
"about the analysis of
human genetic variation.",4648.41,4.03
I hope you've enjoyed it.,4652.44,1.54
"Once again, on Thursday
we have Ron Weiss coming.",4653.98,4.477
Thank you very much.,4658.457,0.833
"This concludes lecture 20 of the
formal material in the course",4659.29,3.142
and we'll see you in lecture.,4662.432,1.208
Thank you very much.,4663.64,2.15
