text,start,duration
"The following
content is provided",0.06,1.72
"under a Creative
Commons license.",1.78,2.239
"Your support will help MIT
OpenCourseWare continue",4.019,2.851
"to offer high quality
educational resources for free.",6.87,3.86
"To make a donation or
view additional materials",10.73,2.61
"from hundreds of MIT courses,
visit MIT OpenCourseWare",13.34,3.877
at ocw.mit.edu.,17.217,0.625
"PROFESSOR: So everybody
ready to rock and roll today?",26.167,3.548
Or at least roll?,29.715,1.425
"OK, if not rock.",31.14,2.21
Welcome back to lecture 20.,33.35,2.75
"On Thursday, we have a special
guest appearance just for you",36.1,4.8
from Professor Ron Weiss.,40.9,1.36
"He's going to be talking
about synthetic biology.",42.26,2.842
"You know, on Richard
Feynman's blackboard,",45.102,3.118
"when he died, was a little
statement I've always",48.22,3.3
"really enjoyed that was actually
encased in a little chalk line.",51.52,3.82
"And it said, ""What I cannot
create, I do not understand.""",55.34,3.48
"And so synthetic
biology is one way",58.82,2.4
"to approach questions in
the biological sciences",61.22,2.807
"by seeing what we
can make-- you know,",64.027,1.583
"whole organisms, new
genomes, rewiring circuitry.",65.61,3.179
"So I think you'll find it to be
a very interesting discussion",68.789,2.541
on Thursday.,71.33,1.39
"But first, before we talk
about synthetic biology,",72.72,3.45
"we have the very
exciting discussion today",76.17,3.13
"on human genetics, which of
course concerns all of us.",79.3,2.85
"And so we're going to
have an exploration today.",82.15,2.52
"And you know, as I
prepared today's lecture,",84.67,2.68
"I wanted to give you the latest
and greatest research findings.",87.35,3.76
"So we're going to talk today
from fundamental techniques",91.11,2.8
"to things that are very
controversial that have caused",93.91,3.65
"fistfights in bars, so
I'm hopeful that you'll",97.56,2.74
"be as engaged as the
people drinking beer are.",100.3,3.01
"So we'll be turning to that
at the end of the lecture,",103.31,2.96
"but first I wanted to tell you
about the broad narrative arc",106.27,5.54
"once again that we're going
to be talking about today.",111.81,2.42
"And we're going to
be looking at how",114.23,2.28
to discover human variation.,116.51,2.49
"We're all different, about
1 based in every 1,000.",119.0,3.45
"And there are two different
broad approaches historically",122.45,4.47
people have used.,126.92,1.719
"Microarrays for
discovering variants,",128.639,2.177
"and we'll talk about
how those were designed.",130.816,1.874
"And we'll talk about
how to actually test",132.69,2.236
"for the significance
of human variation",134.926,1.624
"with respect to a particular
disease in a case and control",136.55,3.38
study.,139.93,0.96
"And then we'll talk about how
to use whole genome read data",140.89,4.64
"to detect variation
between humans",145.53,2.22
"and some of the
challenges in that,",147.75,1.86
"because it does not
make as many assumptions",149.61,3.26
"as the microarray studies,
and therefore is much, much",152.87,4.36
more complicated to process.,157.23,1.99
"And so we're going to
take a view into the best",159.22,2.71
"practices of processing
human read data",161.93,3.35
"so you can understand what
the state of the art is.",165.28,2.72
"And then we're going to
turn to a study showing",168.0,3.45
"how we can bring together
different threads we've",171.45,2.64
talked about in this subject.,174.09,3.08
"In particular, we've
talked about the idea",177.17,2.27
"that we can use other genomic
signals such as histone marks",179.44,4.65
"to identify things like
regulatory elements.",184.09,2.77
"So we're going to talk about
how we can take that lens",186.86,3.61
"and focus it on the
genome to discover",190.47,2.14
"particular genomic variants that
have been revealed to be very",192.61,5.16
"important in a
particular disease.",197.77,3.93
"And finally, we'll
talk about the idea",201.7,2.8
"that what-- the beginning
we're going to talk about today",204.5,2.4
is all about correlation.,206.9,3.05
"And as all of you go forward
in your scientific career,",209.95,4.33
"I'm hopeful that you'll always
be careful to not confuse",214.28,3.89
"association or correlation
with causation.",218.17,4.46
"You're always respected
when you clearly",222.63,1.794
"articulate the difference when
you're giving a talk saying",224.424,2.416
"that this is correlated,
but we don't necessarily",226.84,2.83
"know it's causative until we do
the right set of experiments.",229.67,4.82
"OK, on that note, we'll turn
to the computational approaches",234.49,5.427
we're going to talk about.,239.917,1.083
"We'll talk about contingency
tables and various ways",241.0,2.92
"of thinking about
them when we discuss",243.92,3.29
"how to identify whether or not
a particular SNP is associated",247.21,4.5
"with a disease using
various kinds of tests.",251.71,4.79
"And then we talk
about read data,",256.5,1.769
"and we'll talk about
likelihood based tests.",258.269,2.901
"How to do things like
take a population",261.17,2.66
"of individuals and
their read data",263.83,1.71
"and estimate the
genotypic frequencies",265.54,2.36
"at a particular
locus using that data",267.9,2.51
"in toto using EM
based techniques.",270.41,3.25
OK?,273.66,1.01
So let us begin then.,274.67,2.07
"Some of the things we're
not going to talk about",279.3,2.0
"include non-random
genotyping failure,",281.3,4.17
"methods to correct for
population stratification,",285.47,2.94
"and structural variants
and copy number variations.",288.41,3.47
"Point three we'll
just briefly touch on,",291.88,2.6
"but fundamentally they're
just embellishments",294.48,3.43
"on the fundamental techniques
we're talking about,",297.91,2.45
"and so I didn't really want
to confuse today's discussion.",300.36,5.81
"Now a Mendelian
disorder is a disorder",306.17,5.13
"defined by a single gene,
and therefore, they're",311.3,5.95
relatively easy to map.,317.25,2.68
"And they also tend to
be in low frequency",319.93,3.13
"in the population because
they're selected against,",323.06,3.16
"especially the more severe
Mendelian disorders.",326.22,3.07
"And therefore, they correspond
to very rare mutations",329.29,2.92
in the population.,332.21,2.89
"By point of contrast, if you
thought about the genetics",335.1,3.36
"we discussed last
time, if you think",338.46,2.342
"about a trait that
actually perhaps",340.802,1.458
"is influenced by 200 genes and
maybe that one of those genes",342.26,5.15
"is not necessary or sufficient
for a particular disease.",347.41,3.73
"As a consequence, it could
be a fairly common variant",351.14,3.2
"and it's only if you're unlucky
enough to get all the other 199",354.34,3.69
"variants will you actually
come down with that syndrome.",358.03,3.69
"And therefore, you can see
that the effect of variation",361.72,3.66
"in the human genome
is inversely related",365.38,2.83
"to its frequency-- that
fairly rare variants can have",368.21,4.45
"very serious effects, whereas
fairly common variants tend",372.66,4.33
to have fewer effects.,376.99,3.23
"And in the first phase of
mapping human variation,",380.22,3.14
"people thought that
common variants",383.36,1.76
"were things that had
an allelic frequency",385.12,1.91
"in the population
of 5% or greater.",387.03,3.95
"And then to burrow down deeper,
the 1000 Genomes Project",390.98,3.96
"surveyed a collection of
different populations.",394.94,3.28
"And therefore, if you
thought that a variant was",398.22,3.71
"prevalent in the
population at frequency",401.93,1.87
"of 0.5%, how many people
would have in the 1000 Genomes",403.8,3.04
Project roughly?,406.84,0.78
"Just make sure among you
we're phase-locked here.",411.7,3.44
"0.5%, 1,000 people--",415.14,2.49
AUDIENCE: 5.,417.63,0.5
"PROFESSOR: 5, great.",418.13,0.97
OK.,419.1,0.97
Good.,420.07,1.86
"Now of course, these are three
different populations or more,",421.93,2.6
"and so it might be that,
in fact, that variant's",424.53,2.9
"only present in one
of the population.",427.43,1.69
"So it just might be
one or two people",429.12,1.541
"that actually have a
particular variant.",430.661,2.509
"So the idea is that the way that
you design SNP chips to detect",433.17,6.15
"single nucleotide polymorphisms,
otherwise known as ""SNPs,""",439.32,4.11
"is that you do these
population-based sequencing",443.43,2.68
"studies and you
design the array based",446.11,3.68
"upon all of the common
variants that you find, OK?",449.79,5.09
"And therefore, the array
gives you a direct readout",454.88,2.42
"in terms of the
variation, in terms",457.3,1.49
of all of these common variants.,458.79,2.13
That's where we'll start today.,460.92,1.89
"And where we'll end today is
sequencing based approaches,",462.81,3.73
"which make no assumptions
whatsoever and just all hell",466.54,4.26
breaks loose.,470.8,1.51
"So you'll see what happens, OK?",472.31,2.33
"But I wanted just to
reinforce the idea",474.64,2.41
"that there are different
allelic frequencies of variants",477.05,3.92
"and that as we get down to
rarer and rarer alleles, right,",480.97,4.66
we have larger effects.,485.63,2.04
"But these higher
frequency alleles",487.67,1.63
"could also have effects even
though they're much smaller.",489.3,5.51
"OK, so let's talk about
how these variants arise",494.81,4.68
"and what they mean in terms
of a small little cartoon.",499.49,5.24
"So long, long ago,
in a world far,",504.73,3.31
"far away, a mutation
occurred where",508.04,3.89
"a base G got mutated
to a base A, OK?",511.93,5.05
"And this was in the context of
a population of individuals--",516.98,5.53
"all happy, smiling individuals
because they all actually",522.51,3.299
do not have a disease.,525.809,0.916
"And our story goes,
what happens is",529.86,2.5
"that we had yet another
generation of people who",532.36,2.26
"are all happy, smiling because
they do not have the disease.",534.62,3.311
Right?,537.931,0.499
"Yes, I do tell
stories at night, too.",541.34,3.46
"And then another
mutation occurred.",544.8,7.49
"And that mutation caused
some subset of those people",552.29,3.37
"to get the mutation and for
them to get the disease.",555.66,3.07
"So the original mutation was
not sufficient for people",558.73,4.97
to get this genetic disease.,563.7,1.86
"It required a second
mutation for them",565.56,2.04
"to get the genetic disease, OK?",567.6,2.78
"So we got at least two
genes involved in it.",570.38,2.713
"OK, the other thing
that we know is",577.83,1.88
"that, in this particular
case, some of the people",579.71,3.16
"have the disease that
don't have this mutation.",582.87,3.88
"And therefore, this
mutation is not necessary.",586.75,3.89
"It's neither necessary
nor sufficient.",590.64,4.06
"Still, it is a marker of a
gene that increases risk.",594.7,6.09
"And that's a
fundamental idea, right,",600.79,1.75
"that you can increase
risk without being",602.54,2.22
"necessary or sufficient to cause
a particular genetic disorder.",604.76,5.71
OK?,610.47,1.1
"And so you get this association
then between genotype",611.57,3.51
"and phenotype, and
that's what we're",615.08,1.5
"going to go looking
for right now.",616.58,1.64
We're on the hunt.,618.22,1.12
"We're going to go looking
for this relationship.",619.34,4.02
"So in certain older
individuals-- hopefully,",623.36,5.19
"not myself in the
future-- what happens",628.55,3.07
"is that your maculus, which
is the center of your eye,",631.62,4.27
degenerates as shown here.,635.89,2.25
"And you get this
unfortunate property",638.14,2.32
"where you can't actually
see in the center",640.46,2.36
of your field of vision.,642.82,1.77
"It's called age-related
macular degeneration.",644.59,3.81
"So to look for the
causes of this, which",648.4,2.5
"is known to be
genetically related,",650.9,3.05
"the authors of the study
collected a collection--",653.95,3.19
"a cohort, as it's called--
of these European-descent",657.14,3.24
"individuals, all who are at
least 60 years old, to study",660.38,4.95
"the genetic foundations
for this disorder.",665.33,2.85
"And so they found
934 controls that",670.82,7.13
"were unaffected by age-related
macular degeneration and 1,238",677.95,6.77
"cases, and they genotyped
them all using arrays.",684.72,3.805
"Now the question is, are
any of the identified",691.13,3.06
"SNPs on the array related
to this particular disorder?",694.19,6.22
"So I'll give you
the answer first",703.34,1.514
"and then we'll
talk about a couple",704.854,1.416
"of different ways of
thinking about this data, OK?",706.27,3.94
So here's the answer.,710.21,2.05
"Here's a particular
SNP, rs1061170.",712.26,5.07
"There are the individuals
with AMD and the controls.",717.33,3.942
"And what you're
looking at up here,",721.272,1.458
"these numbers are the
allelic counts, all right?",722.73,2.28
"So each person has
how many alleles?",725.01,3.35
"Two, right?",728.36,1.4
"That's double the
number of individuals.",729.76,2.82
"And the question is,
are the C and T alleles",732.58,4.88
"associated with the cases
or controls significantly?",737.46,7.31
"And so you can compute
a Chi-square metric",744.77,2.9
"on this so-called
contingency table.",747.67,2.15
"And one of the things
about contingency tables",749.82,2.397
"that I think is
important to point out",752.217,1.583
"is that you hear about
marginal probabilities, right?",753.8,3.11
"And people probably
know that originally",756.91,1.73
"derived from the
idea of these margins",758.64,1.7
"along the side of a
contingency table, right?",760.34,3.05
"If you think about the marginal
probability of somebody",763.39,3.1
"having a C allele, regardless
of whether a case or control,",766.49,2.98
"it would be 2,192
over 4,344, right?",769.47,6.51
"So the formula for computing
the Chi-square statistic",775.98,2.46
is shown here.,778.44,1.27
"It's this sort of
scary-looking polynomial.",779.71,3.75
"And the number of
degrees of freedom is 1.",783.46,3.27
"It's the number of rows
minus 1 times the number",786.73,3.22
of columns minus 1.,789.95,1.93
"And the P-value we get is
indeed quite small-- 10",791.88,3.54
to the minus 62.,795.42,2.03
"Therefore, the
chance this happened",797.45,1.47
"at random-- even with
multiple hypothesis",798.92,2.75
"correction, given that we're
testing a million SNPs--",801.67,3.57
"is indeed very, very low.",805.24,3.36
This looks like a winner.,808.6,1.08
"Looks like we've got a
SNP that is associated",809.68,3.26
with this particular disease.,812.94,3.59
"Now just to remind you about
Chi-square statistics--",816.53,3.58
"I'm sure people have seen this
before-- the usual formulation",820.11,3.98
"is that you compute this
Chi-square polynomial",824.09,6.06
"on the right-hand side,
which is the observed",830.15,2.304
"number of something minus the
expected number of something",832.454,2.416
"squared over the expected
number or something, right?",834.87,3.69
"And you sum it up over
all the different cases.",838.56,3.314
"And you can see that the
expected number of As",841.874,1.916
"is given by the little
formula on the left.",843.79,3.56
"Suffice to say, if you expand
that formula and manipulate it,",847.35,4.03
"you get the equation we
had on the previous slide.",851.38,2.85
"So it's still that fuzzy,
friendly Chi-square formula",854.23,2.83
"you always knew, just
in a different form, OK?",857.06,5.72
"Now is there
another way to think",862.78,2.37
"about computing the likelihood
of seeing data in a contingency",865.15,4.99
"table at random, right?",870.14,1.77
"Because we're always asking,
could this just be random?",871.91,3.35
"I mean, could this have
occurred by chance,",875.26,2.12
"that we see the data arranged
in this particular form?",877.38,4.75
"Well, we've another
convenient way",882.13,2.33
"of thinking about
this, which is we could",884.46,3.78
"do Fisher's Exact Test,
which is very related",888.24,4.16
"to the idea of the
hypergeometric test",892.4,3.077
"that we've talked
about before, right?",895.477,1.583
"What are the chances we would
see exactly this arrangement?",897.06,6.75
"Well, we would need to have,
out of a plus b C alleles,",903.81,3.83
"we'd have 8 of them be cases,
which is the first term there",907.64,6.51
in that equation.,914.15,4.85
"And of the T alleles, we need to
have c of them out of c plus d",919.0,3.536
be there.,922.536,1.004
"And then we need to have a
plus b plus c plus d choose",923.54,2.72
"a plus c-- that's the
total number of chances",926.26,2.82
of seeing things.,929.08,1.21
"So this is the probability
of the arrangement",930.29,3.15
"in the table in this
particular form.",933.44,3.53
"Now people-- I'll let
you digest that for one",936.97,2.78
second before I go on.,939.75,1.29
"So this is the number of ways
on the numerator of arranging",944.73,6.65
"things to get the table
the way that we see it",951.38,2.45
"over the total number or
ways of arranging the table,",953.83,2.45
"keeping the marginal
totals the same.",956.28,2.9
Is that clear?,961.93,2.03
"So this is the probability,
the exact probability,",963.96,3.43
"of seeing the table
in this configuration.",967.39,2.69
"And then what you do is you
take that probability and all",970.08,2.475
"of the probabilities for all the
more extreme values, say, of a.",972.555,6.665
"And you sum them all
up and that gives you",979.22,2.74
"the probability of
a null hypothesis.",981.96,2.97
"So this is another
way to approach",984.93,3.92
"looking at the chance a
particular contingency table",988.85,3.81
"set of values would
occur at random.",992.66,2.5
"So if people talk about
Fisher's Exact Test-- you know,",995.16,2.7
tonight at that cocktail party.,997.86,1.404
"""Oh yeah, I know about that.",999.264,1.166
"Yeah, it's like
the hypergeometric.",1000.43,1.25
"It's no big deal.""",1001.68,0.73
You know?,1002.41,0.47
Right.,1002.88,0.499
All right.,1005.88,2.05
"So now let us suppose that
we do an association test",1007.93,7.46
and you do the following design.,1015.39,1.67
"You say, well, I've
got all my cases.",1017.06,3.27
"They're all at Mass General and
I want to genotype them all.",1020.33,5.333
"And Mass General
is the best place",1025.663,1.416
"for this particular disease,
so I'm going to go up there.",1027.079,2.375
"I need some controls but I'm
running out of budgetary money,",1029.454,3.226
"so I'm going to do all my
controls in China, right?",1032.68,3.294
"Because I know it's going
to be less expensive there",1035.974,2.166
to genotype them.,1038.14,0.85
"And furthermore--
as a little aside,",1038.99,4.36
"I was once meeting
with this guy who",1043.35,1.499
"is like one of the ministers
of research in China.",1044.849,5.151
He came to my office.,1050.0,1.01
"I said, so what do
you do in China?",1051.01,2.125
"And he said, well, I guess
the best way to describe",1053.135,2.125
"it is that I'm in charge of the
equivalent of the NSF, DARPA,",1055.26,2.73
and the NIH.,1057.99,1.355
"I said, oh.",1059.345,2.465
"I said, would like to
meet the president?",1061.81,2.39
"Because I'd be happy to
call MIT's president.",1064.2,2.09
"I'm sure they'd be
happy to meet with you.",1066.29,1.06
"He said, no.",1067.35,0.88
"He said, I like going direct.",1068.23,2.2
"So, at any rate,
I told him I was",1070.43,2.72
working in stem cell research.,1073.15,1.53
"He said, you know, one thing I
can say about China-- in China,",1074.68,2.91
"stem cells, ethics, no problem.",1077.59,1.78
[LAUGHTER],1079.37,4.98
"At any rate, so you go to
China to do your controls, OK?",1084.35,5.16
"And why is that a bad
experimental design?",1089.51,3.67
Can anybody tell me?,1093.18,0.84
"You do all your cases here,
you do your controls in China.",1098.128,2.416
Yes?,1100.544,0.452
"AUDIENCE: Because
the SNPs in China",1100.996,1.458
are not necessarily the same.,1102.454,1.256
PROFESSOR: Yes.,1103.71,0.68
"The Chinese population's
going to have",1104.39,1.95
"a different set of SNPs,
right, because it's",1106.34,1.853
been a contained population.,1108.193,1.199
"So you're going to
pick up all these SNPs",1109.392,1.708
"that you think are going to
be related to the disease that",1111.1,2.62
"are simply a consequence of
population stratification,",1113.72,3.05
right?,1116.77,1.1
"So what you need to do
is to control for that.",1117.87,3.12
"And the way you do that is you
pick a bunch of control SNPs",1120.99,3.04
"that you think are
unrelated to a disease",1124.03,2.54
"and you do a Chi-square
test on those",1126.57,1.99
"to make sure that they're
not significant, right?",1128.56,4.39
"And methodologies for
controlling for population",1132.95,2.68
"stratification by picking
apart your individuals",1135.63,3.02
"and re-clustering
them is something",1138.65,2.211
"that is a topic of
current research.",1140.861,1.499
"And finally, the good news
about age-related macular",1145.84,3.79
"degeneration is that
there are three genes",1149.63,2.91
"with five common variants
that explain 50% of the risk.",1152.54,3.14
"And so it has been viewed as
sort of a very successful study",1155.68,5.16
"of a polygenic-- that
is, multiple gene--",1160.84,3.38
"genetic disorder that
has been dissected",1164.22,2.02
using this methodology.,1166.24,1.24
"And with these genes, now
people can go after them",1167.48,3.31
"and see if they can come up
appropriate therapeutics.",1170.79,4.22
"Now using the same idea-- cases,
controls-- you look at each SNP",1175.01,6.33
"individually and you
query it for significance",1181.34,4.23
based upon a null model.,1185.57,1.9
"You can take a wide
range of common diseases",1187.47,5.53
"and ask whether or
not you can detect",1193.0,3.38
"any genetic elements that
might influence risk.",1196.38,7.07
"And so here are a set
of different diseases,",1203.45,2.8
"starting with bipolar
disorder at the top,",1206.25,1.75
"going down to type 2
diabetes at the bottom.",1208.0,2.74
"This is a so-called
Manhattan plot,",1210.74,3.48
"because you see the buildings
along the plot, right?",1214.22,3.002
"And when there are
skyscrapers, you",1217.222,1.458
"go, whoa, that could be
a problem, all right?",1218.68,3.14
"And so this is the
style-- you see,",1221.82,2.81
"this came out in
2007-- of research",1224.63,3.62
"that attempts to do genome
wide scans for loci that",1228.25,4.022
"are related to
particular diseases.",1232.272,1.458
"OK, now, I'd like to go on
and talk about other ways",1236.89,5.61
"that these studies can
be influenced, which",1242.5,7.89
"is the idea of linkage
disequilibrium.",1250.39,8.1
"So for example, let us say that
I have a particular individual",1258.49,16.32
"who's going to produce a
gamete and the gamete's going",1274.81,5.66
"to be haploid, right?",1280.47,4.02
"And it's going have one
allele from one of these two",1284.49,5.83
"chromosomes and one allele from
one of these two chromosomes.",1290.32,3.51
"We've talked about
this before last time.",1293.83,2.76
"And there are four
possibilities--",1296.59,2.08
"AB, aB, Ab, and ab, OK?",1298.67,9.85
"And if this was a
coin flip, then each",1308.52,4.3
"of these genotypes
for this gamete",1312.82,3.75
"would be identical, right?",1316.57,4.23
"But let us suppose
that I tell you",1320.8,2.66
"that there are only two
that result-- this one, AB,",1323.46,6.81
"and the small one, ab, OK?",1330.27,3.705
"If you look at this, you
say, aha, these two things",1336.67,3.21
"are linked and they're
very closely linked.",1339.88,4.39
"And so, if they're always
inherited together,",1344.27,3.69
"we might think that the distance
between them on the genome",1347.96,7.59
is small.,1355.55,1.27
"So in the human genome,
what's the average distance",1359.67,3.2
"between crossover events
during a meiotic event?",1362.87,3.08
"Does anybody know, roughly
speaking, how many bases?",1365.95,3.691
Hm?,1369.641,0.499
AUDIENCE: A megabase?,1370.14,0.874
PROFESSOR: A megabase.,1371.014,0.936
Little low.,1371.95,1.18
"How many centimorgans
long is the human genome?",1376.22,3.24
All right?,1383.46,1.751
Anybody know?,1385.211,2.939
"3,000?",1388.15,0.75
"4,000?",1388.9,1.776
Something like that?,1390.676,2.444
"So maybe 50 to 100 megabases
between crossover events, OK?",1393.12,6.12
"So if these markers
are very closely",1399.24,9.38
"organized along the genome,
the likelihood of a crossover",1408.62,3.04
is very small.,1411.66,2.27
"And therefore, they're going
to be in very high LD, right?",1413.93,3.53
"And a way to measure that is
with the following formula,",1420.16,6.18
"which is that if you link the
two locuses-- we have L1 and L2",1426.34,3.47
here.,1429.81,1.02
"And now we're talking about
the population instead",1430.83,2.91
of a particular individual.,1433.74,3.34
"If the likelihood of the
capital allele A is piece of A",1437.08,6.66
"and the probability
of the big B allele",1443.74,2.91
"is piece of B, then if they
were completely unlinked,",1446.65,5.784
"then the likelihood of
inheriting both of them",1452.434,1.916
"together with would be
piece of A times piece of B,",1454.35,3.97
showing independence.,1458.32,2.2
"However if they
aren't independent,",1460.52,2.2
"we can come up
with a single value",1462.72,1.62
"D which allows us to quantify
the amount of disequilibrium",1464.34,5.81
between those two alleles.,1470.15,2.4
"And the formula for D
is given on the slide.",1472.55,4.54
"And furthermore, if it's
more convenient for you",1477.09,2.48
"to think about in terms
of r-squared correlation,",1479.57,2.62
"we can define the
r-squared correlation",1482.19,2.23
"as D squared over
PA, QA, PB, QB,",1484.42,3.0
"as shown in the lower left
hand part of this slide, OK?",1487.42,4.24
"This is simply a
way of describing",1491.66,3.87
"how skewed the
probabilities are from being",1495.53,2.96
"independent for
inheriting these two",1498.49,3.87
different loci in a population.,1502.36,5.49
"Are there any questions
at all about that,",1507.85,3.03
the details of that?,1510.88,3.26
OK.,1514.14,0.8
"So just to give you an example,
if you look at chromosome 22,",1514.94,5.86
"the physical distance on
the bottom is in kilobases,",1520.8,3.66
