text,start,duration
"so that's from 0 to 1
megabase on the bottom.",1524.46,4.45
"And you look at the
r-squared values,",1528.91,2.23
"you can see things that
are quite physically close,",1531.14,3.5
"as we suggested earlier,
have a high r-squared value.",1534.64,3.22
"But there are still
some things that",1537.86,1.5
"are pretty far away
that have surprisingly",1539.36,2.87
high r-squared values.,1542.23,1.275
"There are recombination
hot spots in the genome.",1546.17,2.72
"And it's, once again, a topic
of current research trying",1548.89,3.8
"to figure out how the genome
recombines and recombination is",1552.69,3.33
targeted.,1556.02,0.697
"But suffice it to say, as you
can see, it's not uniform.",1556.717,2.333
"Now what happens as
a consequence of this",1562.19,2.95
"is that you get regions
of the genome where",1565.14,3.5
"things stick together, right?",1568.64,1.42
"They're all drinking
buddies, right?",1570.06,1.5
"They all hang out together, OK?",1571.56,3.31
"But here's what I'm going to ask
you-- how much of your genome",1574.87,2.87
came from your dad?,1577.74,1.0
Half.,1581.392,0.888
"How much came from
your dad's dad?",1582.28,1.482
AUDIENCE: A quarter.,1583.762,1.146
"PROFESSOR: And from
your dad's dad's dad?",1584.908,1.708
AUDIENCE: An eighth.,1586.616,0.833
"PROFESSOR: An eighth, OK?",1587.449,1.151
"So the amount of your genome
going back up the family tree",1588.6,3.13
"is falling off exponentially
up a particular path, right?",1591.73,3.93
"So if you think about groups
of things that came together",1595.66,3.31
"from your great,
great grandfather",1598.97,1.47
"or his great, great
grandfather, right,",1600.44,2.47
"the further back you go, the
less and less contribution",1602.91,3.249
"they're going to
have to your genome.",1606.159,1.541
"And so the blocks are
going to be smaller--",1607.7,2.88
"that is, the amount
of information",1610.58,1.89
"you're getting from
way back up the tree.",1612.47,3.73
"So if you think about
this, the question",1616.2,2.86
"of what blocks of things
are inherited together",1619.06,3.51
"is not something that you
can write an equation for.",1622.57,2.82
"It's something that you
study in a population.",1625.39,2.19
"You go out and you
ask, what things do we",1627.58,2.28
observe coming together?,1629.86,1.53
"And generally, larger
blocks of things",1631.39,3.95
"are inherited together, occur
in more recent generations,",1635.34,4.42
"because there's less
dilution, right?",1639.76,2.17
"Whereas if you go way
back in time-- not quite",1641.93,2.326
"to where the dinosaurs
roamed the land,",1644.256,1.624
"but you get the idea-- the
blocks are, fact, quite small.",1645.88,3.84
"And so, the HapMap project
went about looking at blocks",1649.72,5.17
"and how they were
inherited in the genome.",1654.89,2.81
"And what suffices to know is
that they found blocks-- here",1657.7,4.73
"you can see three
different blocks.",1662.43,4.03
"And these are called
haplotype blocks",1666.46,1.99
"and the things that
are colored red",1668.45,1.95
"are high r-squared
values between",1670.4,2.42
different genetic markers.,1672.82,2.54
"And we talked earlier
about how to compute",1675.36,1.75
that r-squared value.,1677.11,1.49
"So those blocks typically
are inherited together.",1678.6,4.05
Yes?,1682.65,0.5
"AUDIENCE: Are these blocks
like fuzzy boundaries?",1683.15,3.626
PROFESSOR: No.,1686.776,0.804
"Well, remember in this
particular example,",1687.58,3.94
"we're only querying at
specified markers which",1691.52,3.39
"are not necessarily at regular
intervals along the genome.",1694.91,4.1
"So in this case, the blocks
don't have fuzzy boundaries.",1699.01,2.65
"As we get into
sequencing-based approaches,",1701.66,2.462
"they could have
fuzzier boundaries.",1704.122,1.458
"But haplotype
blocks are typically",1705.58,1.5
"thought to be discrete blocks
that are inherited, OK?",1707.08,4.0
Good question.,1711.08,0.61
Any other questions?,1711.69,0.833
OK.,1716.84,0.51
"So I want to impress
upon the idea",1717.35,3.69
"that this is empirical, right?",1721.04,2.01
"There's no magic here in
terms of fundamental theory",1723.05,3.96
"about what things should
be haplotype blocks.",1727.01,2.63
"It's simply that you
look at a population",1729.64,1.91
"and you're look at what
markers are drinking buddies",1731.55,3.13
"and those make haplotype blocks
and you empirically categorize",1734.68,4.07
"and catalog them-- which can
be very helpful, as you'll see.",1738.75,5.47
"And thus, when we think
about genetic studies,",1744.22,2.93
"when we think about the
length of shared segments,",1747.15,3.84
"if you're thinking
about studying a family,",1750.99,1.99
"like a trio-- a trio is a mom,
a dad, and a child, right?",1752.98,3.954
"They're going to share a
lot of genetic information,",1756.934,2.166
"and so the haplotype blocks that
are shared amongst those three",1759.1,2.86
"individuals are going
to be very large indeed.",1761.96,3.43
"Whereas if you go
back generations,",1765.39,1.92
"the blocks-- like the
second cousins or things",1767.31,2.78
"like that-- the
blocks get smaller.",1770.09,2.09
"So the x-axis on this
plot is the median length",1772.18,4.08
of a shared segment.,1776.26,2.22
"And as an association
study, which",1778.48,1.93
"is taking random people
out of the population,",1780.41,3.85
"has very small shared
blocks indeed, OK?",1784.26,3.894
"And so the techniques
that we're talking about",1788.154,1.916
"today are applicable
almost in any range,",1790.07,2.96
"but they're particularly
useful where",1793.03,2.63
"you can't depend upon
the fact that you're",1795.66,2.12
"sharing a lot of information
along the genome proximal",1797.78,2.47
"to where the marker
is that's associated",1800.25,1.912
with a particular disease.,1802.162,1.083
"Now the other thing
that is true is",1807.21,3.56
"that we should note that
the fact that markers have",1810.77,4.35
"this LD associated
with them means",1815.12,2.99
"that it may be that a particular
marker is bang on-- what's",1818.11,7.19
called a causative SNP.,1825.3,1.89
"Or something that,
for example, sits",1827.19,2.04
"in the middle of a gene
causing a missense mutation.",1829.23,4.42
"Or it sits right in the middle
of a protein binding site,",1833.65,2.96
"causing the factor
not to bind anymore.",1836.61,2.88
"But also it could be something
that is actually a little bit",1839.49,2.83
"away, but is highly correlated
to the causative SNP.",1842.32,5.76
"So just keep in mind that
when you have an association",1848.08,2.45
"and you're looking at a SNP, it
may not be the causative SNP.",1850.53,5.4
"It might be just linked
to the causative SNP.",1855.93,2.714
"And sometimes these things
are called proxy SNPs.",1858.644,2.041
"OK, so we've talked
about the idea of SNPs",1863.29,9.24
and discovering them.,1872.53,1.93
"Let me ask you one more question
about where these SNPs reside",1874.46,5.055
"and see if you
could help me out.",1879.515,1.715
"OK, this is a really
important gene, OK?",1890.68,7.82
"Call it RIG for short, OK?",1898.5,2.42
"Now let us suppose that
you know that there",1900.92,3.43
are some mutations here.,1904.35,1.75
"And my question for you is,
does it matter whether or not",1906.1,5.98
"the two mutations look
like this or the mutations",1912.08,6.33
"look like this, in your opinion?",1918.41,4.85
"That is, both mutations
occur in one copy",1926.99,2.48
"or on one chromosome
of the gene,",1929.47,2.86
"whereas in the other case, we
see two different SNPs that",1932.33,3.01
"are different than
reference, but they're",1935.34,1.77
"referring in both
mom and dad alleles.",1937.11,2.13
"Is there a difference
between those two cases?",1944.26,4.131
Yeah?,1948.391,0.499
"AUDIENCE: In terms of
the phenotype displayed?",1948.89,1.956
"PROFESSOR: In terms of
the phenotype, sorry.",1950.846,2.445
AUDIENCE: It depends.,1953.291,1.467
PROFESSOR: It depends?,1954.758,0.978
AUDIENCE: Yes.,1955.736,0.583
PROFESSOR: OK.,1956.319,0.884
"AUDIENCE: So if it causes a
recessive mutation, then no,",1957.203,3.912
"because other genes will
be able to rescue it.",1961.115,5.379
"But if it's dominant,
then it'll still--",1966.494,1.667
"PROFESSOR: It's actually
the other way around.",1968.161,1.916
"If it's recessive,
this does matter.",1970.077,1.803
"AUDIENCE: Oh, I see.",1971.88,1.59
"PROFESSOR: Because in this
case, with the purple ones,",1973.47,2.25
"you still have one good
copy of the gene, right?",1975.72,3.52
"However, with the
green ones, it's",1979.24,1.86
"possible that you have
ablated both good copies",1981.1,3.21
"of the gene, this
really important gene,",1984.31,2.37
"and therefore, you're
going to get a higher",1986.68,2.23
"risk of having a
genetic disorder.",1988.91,3.37
"So when you're scanning down
the genome then-- you know,",1992.28,5.15
"we've been asking where
are there differences",1997.43,3.25
"from reference or from
between cases and controls",2000.68,3.76
"down the genome, but we
haven't asked whether or not",2004.44,3.89
"they're on mom or dad, right?",2008.33,2.969
"We're just asking,
are they there?",2011.299,1.416
"But it turns out that
for questions like this,",2015.41,3.79
"we have to know whether or
not the mutation occurred",2019.2,5.35
"in only in mom's chromosome
or in both chromosomes",2024.55,3.9
"in this particular
neighborhood, all right?",2028.45,4.75
"This is called phasing
of the variants.",2033.2,4.86
"Phasing means
placing the variants",2038.06,2.2
on a particular chromosome.,2040.26,5.08
"And then, by phasing
the variants,",2045.34,1.96
"you can figure out some
of the possible phenotypic",2047.3,2.839
consequences of them.,2050.139,1.691
"Because if they're not
they phased, in this case,",2051.83,4.0
"it's going to be much less
clear what's going on.",2055.83,4.014
"So then the question
becomes, how",2059.844,1.375
"do we phase variants, right?",2061.219,2.801
"So phasing assigns alleles
to the parental chromosomes.",2064.02,4.65
"And so, the set of alleles along
a chromosomes is a haplotype.",2068.67,4.33
"We've talked about the
idea of haplotypes.",2073.0,2.98
"So imagine one way to phase
is that if I tell you,",2075.98,5.8
"by magic, in this population
you're looking at,",2081.78,3.1
"here are all the
haplotypes and these",2084.88,3.16
are the only ones that exist.,2088.04,2.57
"You look in your
haplotypes and you go, aha,",2090.61,3.98
"this haplotype exists but
this one does not, right?",2094.59,5.97
"That this is a haplotype--
this two purples together",2100.56,2.98
"is a haplotype, and
this green without one",2103.54,1.77
is another haplotype.,2105.31,1.245
"So you see which
haplotypes exist-- that is,",2106.555,4.135
"what patterns of inheritance
of alleles along a chromosome",2110.69,4.68
you can detect.,2115.37,2.23
"And using the established
empirical haplotypes,",2117.6,3.48
"you can phase the variants, OK?",2121.08,4.11
"Now the other way to
phase the variants",2125.19,2.39
"is much, much simpler
and much better, right?",2127.58,4.504
"The other way to
phase variants is",2132.084,1.416
"you just have a single read that
covers the entire thing, right?",2133.5,5.83
"And then the read, it
will be manifest, right?",2139.33,2.78
"The read will cover
the entire region",2142.11,2.12
"and then you see
the two mutations",2144.23,2.76
"in that single
region of the genome.",2146.99,1.86
"The problem we're up against
is that most of our reads",2148.85,2.56
"are quite short and we're
reassembling our genotypes",2151.41,4.93
from a shattered genome.,2156.34,2.8
"If the genome wasn't
shattered, then we",2159.14,2.18
wouldn't have this problem.,2161.32,2.0
"So everybody's
working to fix this.",2163.32,3.46
"Illumina has sort of a
cute trick for fixing this.",2166.78,5.31
"And PacBio, which is
another sequence instrument",2172.09,3.26
"manufacturer, can produce reads
that are tens of thousands",2175.35,3.62
"of bases long, which allows
you to directly phase",2178.97,3.204
the variants from the reads.,2182.174,1.166
"But if somebody,
once again, comes up",2185.519,1.541
"to you at the cocktail party
tonight and says, you know,",2187.06,2.59
"I've never understood why
you have to phase variants.",2189.65,4.6
"You know, this is a popular
question I get all the time.",2194.25,2.76
[LAUGHTER],2197.01,1.744
"You can tell them,
hey, you know,",2198.754,2.666
"you have to know whether or
not mom and dad both have",2201.42,3.2
"got big problems or just all
the problems are with mom, OK?",2204.62,4.42
Or dad.,2209.04,1.41
"So you can put
their mind at ease",2210.45,3.23
"as you're finishing
off the hors d'oeuvres.",2213.68,1.93
"OK, so I wanted just to tell
you about phasing variants",2215.61,3.63
"because we're about to go on to
the next part of our discussion",2219.24,4.16
today.,2223.4,1.46
"We are leaving the very
clean and pristine world",2224.86,3.17
"of very defined SNPs,
defined by microarrays,",2228.03,3.52
"into the wild and woolly world
of sequencing data, right?",2231.55,4.48
Which is all bets are off.,2236.03,2.81
"It's all raw
sequencing data and you",2238.84,2.53
"have to make sense
of it-- hundreds",2241.37,3.13
of millions of sequencing reads.,2244.5,2.93
"So today's lecture is drawn from
a couple of different sources.",2247.43,5.05
"I've posted some of
them on the internet.",2252.48,3.24
"There's a very nice article
by Heng Li on the underlying",2255.72,2.88
"mathematics of SNP calling and
variation which I've posted.",2258.6,4.41
"In addition, some of
the material today",2263.01,2.74
"is taken from the Genome
Analysis Toolkit, which",2265.75,2.43
"is a set of tools
over at the Broad,",2268.18,2.18
"and we'll be talking about
that during today's lecture.",2270.36,3.562
"The best possible case when
you're looking at sequence data",2273.922,2.458
"today is that you get
something like this, all right?",2276.38,2.62
"Which is that you have
a collection of reads",2279.0,2.34
"for one individual and you
align them to the genome",2281.34,6.03
"and then you see that
some of the reads",2287.37,2.01
"have a C at a particular base
position and other of the reads",2289.38,3.31
have a T at that base position.,2292.69,3.8
"And so it's a very
clean call, right?",2296.49,2.17
"You have a CT heterozygote
at that position-- that",2298.66,4.32
"is, whatever person that
is is a heterozygote there.",2302.98,4.26
"You can see the reference genome
at the very bottom, right?",2307.24,2.576
"So it's very difficult for
you to read in the back,",2309.816,2.124
but C is the reference allele.,2311.94,2.81
"And the way that
the IGV viewer works",2314.75,3.82
"is that it shows non-reference
alleles in color,",2318.57,2.57
"so all those are the T alleles
you see there in red, OK?",2321.14,5.27
"And it's very, very
beautiful, right?",2326.41,3.257
"I mean you can tell
exactly what's going on.",2329.667,1.833
"Now we don't know whether
or not the C or the T allele",2331.5,4.39
"are a mom and dad
respectively, right?",2335.89,1.937
"We don't know which of the
chromosomes they're on,",2337.827,2.083
"but suffice to say,
it's very clean.",2339.91,4.43
"And the way that all of
this starts, of course,",2344.34,1.96
is with a BAM file.,2346.3,2.58
"You guys have seen
BAM files before.",2348.88,1.88
I'm not going to belabor this.,2350.76,1.61
"There's a definition
here and you",2352.37,2.1
"can add extra
annotations on BAM files.",2354.47,2.012
"But the other thing
I wanted to point out",2356.482,1.708
"is that you know that BAM
files include quality scores.",2358.19,3.56
"So we'll be using those quality
scores in our discussion.",2361.75,3.7
"The output of all
this typically is",2365.45,2.6
"something called a variant
call file or a VCF file.",2368.05,6.27
"And just so you are
not completely scared",2374.32,6.49
"by these files, I want to
describe just a little bit",2380.81,2.18
about their structure.,2382.99,1.52
"So there's a header
at the top telling you",2384.51,2.29
what you actually did.,2386.8,1.76
"And then chromosome 20 at this
base location has this SNP.",2388.56,4.71
"The reference allele is
G, the alternative allele",2393.27,2.84
"is A. This is some
of the statistics",2396.11,4.334
"as described by this
header information,",2400.444,1.666
like DP is the read depth.,2402.11,3.13
"And this tells you the status
of a trio that you processed.",2405.24,4.63
"So this is the
allele number for one",2409.87,12.099
"of the chromosomes,
which is 0, which",2421.969,1.541
"is a G. The other one's
a G, and so forth.",2423.51,3.1
"And then this data right
here is GT, GQ, GP,",2426.61,4.047
which are defined up here.,2430.657,1.083
"So you have one person,
second person, third person,",2431.74,4.08
"along with which one
of the alleles, 0 or 1,",2435.82,4.17
"they have on each of
their chromosomes, OK?",2439.99,3.12
So this is the output.,2443.11,1.37
"You put in raw reads
and what you get out",2444.48,2.37
"is a VCF file that for
bases along the genome",2446.85,3.4
"calls variance, OK?",2450.25,5.01
"So that's all there
is to it, right?",2455.26,1.93
You take in your read data.,2457.19,2.34
"You take your genome, throw
it through the sequencer.",2459.53,3.14
"You take the BAM file,
you call the variants,",2462.67,3.63
"and then you make your
medical diagnosis, right?",2466.3,3.6
"So what we're going to
talk about is what goes on",2469.9,2.49
"in the middle there,
that little step-- how",2472.39,1.91
"do you actually
call the variants?",2474.3,2.21
"And you might say, gee,
that does not seem too hard.",2476.51,2.179
"I mean, I looked at
the slide you showed me",2478.689,1.791
with the CT heterozygote.,2480.48,1.49
"That looked beautiful, right?",2481.97,1.7
"I mean, that was just gorgeous.",2483.67,1.82
"I mean, these sequencers are
so great and do so many reads,",2485.49,2.95
"what can be hard
about this, after all?",2488.44,2.43
"You know, it's a quarter
to 2:00, time to go home.",2490.87,3.44
"Not quite, OK?",2494.31,0.86
Not quite.,2495.17,0.5
"The reason is actual
data looks like this.",2495.67,4.72
"So these are all reads
aligned to the genome",2500.39,1.87
"and, as I told you
before, all the colors are",2502.26,1.874
non-reference bases.,2504.134,2.376
"And so you can see that
the reads that come out",2506.51,4.01
"of an individual are
very messy indeed.",2510.52,3.55
"And so we need to deal with
those in a principled way.",2514.07,2.57
"We need to make good,
probabilistic assessments of",2516.64,3.41
"whether or not there's a
variant at a particular base.",2520.05,4.29
"And I'm not going to belabor
all the steps of the Genome",2524.34,4.06
"Analysis Toolkit,
suffice to say,",2528.4,1.98
"here is a flow chart of all
the steps that go through it.",2530.38,3.24
"First, you map your reads.",2533.62,2.3
You recalibrate the scores.,2535.92,2.8
"You compress the
read set and then",2538.72,2.4
"you have read sets for
n different individuals.",2541.12,3.83
"And then you jointly call
the variants and then you",2544.95,2.48
"improve upon the variants
and then you evaluate, OK?",2547.43,4.7
"So I'll touch upon some of
the aspects of this pipeline,",2552.13,2.95
"the ones that I think
are most relevant,",2555.08,2.01
"so that you can appreciate
some of the complexity",2557.09,4.31
in dealing with this.,2561.4,1.832
"Let me begin with the
following question.",2563.232,1.708
"Let us suppose that you have
a reference genome here,",2567.46,7.29
"indicated by this line,
and you align a read to it.",2574.75,3.43
"And then there's some base
errors that are non-reference,",2578.18,3.525
"so it's variants calls down
at this end of the read, OK?",2581.705,3.765
"So this is the five
prime, three prime.",2585.47,2.48
"And then you align a read
from the opposite strand",2587.95,6.05
"and you have some variant
calls on the opposite end",2594.0,6.71
of the read like this.,2600.71,0.95
"And you'll say to yourself,
what could be going on here,",2604.137,2.333
you know?,2606.47,0.95
"Why is it that they're
not concordant, right,",2607.42,4.05
"when they're mapped, but
they're in the same region",2611.47,3.84
of the genome?,2615.31,0.6
"And then you think
to yourself, well,",2618.71,2.2
"what happens if I map this
successfully here correctly",2620.91,4.827
"to the reference genome
and this correctly",2625.737,1.749
"to the reference genome here,
but this individual actually",2627.486,4.524
"had a chromosome that had
a deletion right here, OK?",2632.01,9.226
"Then what would happen would
be that all these reads down",2641.236,2.374
"here are going to be
misaligned, all of these bases",2643.61,2.734
"are going to be misaligned
with the reference.",2646.344,1.916
"And so you're going
to get variant calls.",2648.26,2.33
"And these bases will be also
misaligned with the reference,",2650.59,3.07
you'll get variant calls.,2653.66,2.54
"So deletions in
an individual can",2656.2,4.21
"cause things to
be mapped but you",2660.41,2.75
get variant calls at the end.,2663.16,4.38
"And so that is shown
here, where you",2667.54,3.21
"have reads that are being mapped
and you have variant calls",2670.75,3.87
at the end of the reads.,2674.62,2.71
"And it's also a
little suspicious",2677.33,1.48
"because in the middle here is
a seven-base pair homopolymer",2678.81,6.17
which is all T's.,2684.98,1.97
"And as we know,
sequencers are notoriously",2686.95,2.57
"bad at correctly
reading homopolymers.",2689.52,4.09
"So if you then
correct things, you",2693.61,4.09
"discover that some
fraction of the reads",2697.7,2.77
"actually have one of the T's
missing and all the variants",2700.47,6.6
"that were present
before go away.",2707.07,3.82
"So this is a process
of INDEL adjustment",2710.89,4.91
"when you are mapping the
region looking for variants.",2715.8,3.93
"Now this does not occur we're
talking about SNP microarrays.",2719.73,6.46
"So this is a problem
that's unique to the fact",2726.19,3.01
"that we're making many
fewer assumptions when",2729.2,2.82
"we map reads to
the genome de novo.",2732.02,2.33
"The second and another
very important step",2737.07,2.4
"that they're very proud
of is essentially--",2739.47,4.62
"I guess how to put this
politely-- finding out",2744.09,2.31
"that manufacturers of
sequencing instruments,",2746.4,2.72
"as you know, for every
base that they give you,",2749.12,2.042
"they give you an estimate
of the probability",2751.162,1.833
"that the base is correct--
or it's wrong, actually.",2752.995,3.245
"A so-called Phred score--
we've talked about that before.",2756.24,3.11
"And as you would imagine,
manufacturers' instruments",2759.35,3.73
"are sometimes optimistic,
to say the least, about",2763.08,3.24
the quality of their scores.,2766.32,1.98
"And so they did a survey of
a whole bunch of instruments",2768.3,4.01
"and they plotted the reported
score against the actual score,",2772.31,4.692
OK?,2777.002,1.358
"And then they have a whole
step in their pipeline",2778.36,2.15
"to adjust the scores, whether
you be a Solexa GA instrument,",2780.51,4.34
"a 454 instrument, a SOLiD
instrument, a HiSeq instrument,",2784.85,3.52
or what have you.,2788.37,1.84
"And there is a way to adjust the
score based upon the raw score",2790.21,5.0
"and also how far down
the read you are,",2795.21,2.6
as the second line shows.,2797.81,2.18
"The second line is a
function of score correction",2799.99,3.25
"versus how far down the read or
number of cycles you have gone.",2803.24,3.91
"And the bottom is adjustments
for dinucleotides,",2807.15,6.154
"because some
instruments are worse",2813.304,1.416
"a certain dinucleotides
than others.",2814.72,1.846
"As you can see, they're very
proud of the upper left hand",2816.566,2.374
part.,2818.94,0.5
"This is one of the major
methodological advances",2819.44,2.06
"of 1000 Genome
Project, figuring out",2821.5,3.11
"how to recalibrate quality
scores for instruments.",2824.61,6.76
Why is this so important?,2831.37,2.95
"The reason it's important
is that the estimate",2834.32,3.97
"of the veracity of
bases figures centrally",2838.29,4.79
"in determining whether or
not a variant is real or not.",2843.08,4.16
"So you need to have as best
an estimate as you possibly",2847.24,3.29
"can of whether or not a base
coming out of the sequencer",2850.53,4.02
"is correct, OK?",2854.55,2.11
"Now if you're doing
lots of sequencing",2860.72,3.34
"of either individuals
or exomes--",2864.06,2.92
"I should talk about exome
sequencing for a moment.",2866.98,3.73
"Up until recently,
it has not really",2870.71,1.5
"been practical to
do whole genome",2872.21,1.94
sequencing of individuals.,2874.15,2.43
"That's why these SNP arrays
were originally invented.",2876.58,3.72
"Instead, people sequenced the
expressed part of the genome,",2880.3,4.25
right?,2884.55,0.5
All of the genes.,2885.05,3.1
"And they can do this
by capture, right?",2888.15,2.01
They go fishing.,2890.16,2.79
"They create fishing poles out of
the genes that they care about",2892.95,6.53
"and they pull out the
sequences of those genes",2899.48,3.07
and they sequence them.,2902.55,1.06
"So you're looking at a
subset of the genome,",2903.61,2.7
but it's an important part.,2906.31,2.66
"Nonetheless, whether or
not you do exome sequencing",2908.97,3.16
"or you do sequencing
of the entire genome,",2912.13,2.89
you have a lot of reads.,2915.02,1.57
"And so the reads that you
care about are the reads that",2916.59,3.59
are different from reference.,2920.18,2.97
"And so you can reduce the
representation of their BAM",2923.15,3.97
"file simply by throwing all
the reads on the floor that",2927.12,3.39
"don't matter, right?",2930.51,1.67
"And so here's an example of
the original BAM file and all",2932.18,2.92
"the reads, and what
you do is you just",2935.1,1.96
"trim it to only the
variable regions, right?",2937.06,4.67
"And so you are
stripping information",2941.73,3.61
"around the variant regions
out of the BAM file",2945.34,6.6
"and things greatly compress
and the downstream processing",2951.94,3.85
becomes much more efficient.,2955.79,1.175
OK.,2959.54,1.93
"Now let's turn to the
methodological approaches",2961.47,4.77
"once we have gotten the
data in as good a form",2966.24,2.53
