text,start,duration,end,dominant_emotion
so penelope you came in off a neuropathy uh advertisement i think uh yes you saw this and you were a teacher by trade and you,1.439,16.641,18.08,angry
liked you liked things yes i was but i changed careers many moons ago how much better do your feet feel you were having burning and numbness how,9.76,19.439,29.198999999999998,angry
much better are you now after a neuropathy program wow uh 90 percent better at least i'd say my legs don't move like they were,20.16,25.680000000000003,45.84,NA
my feet don't tingle the same way there's still a little bit but nothing like it was when i first came in absolutely nothing so i really responded to uh the treatment very well,31.439,32.961,64.4,NA
and um i well i'm still sort of in it um on reduced visits but it was extremely helpful and i would definitely recommend this for anybody,48.48,30.799,79.279,angry
well thank you for being such a great patient and for all the good things you say so well i don't see them unless i mean them so wonderful well thank you,64.32,28.078999999999997,92.39899999999999,angry
