text,start,duration,end,dominant_emotion
the human brain is very complex but when we look at the brains of simpler animals we see that the human brain has evolved from them gradually by changing the size and the placement of common brain,2.01,24.781,26.790999999999997,NA
regions and that diverse animals share common brain regions again suggesting that we can study them in simpler animals not just in humans in fact we can see when we compare the human in the,14.79,25.95,40.739999999999995,NA
monkey how similar they are we can see in the rat and the mouse that some of the same regions are sort of changed in location and changed in size if we go all the way down to the shark brain we,27.93,20.608999999999998,48.539,NA
see something that looks on the outside very different instruction from the human brain below but by understanding what the different brain regions are we can see that in fact the parts of the,38.67,20.849,59.519000000000005,NA
shark brain and the parts of the human brain are rather similar that even the higher processing centers are present in the shark along with regions that control things like movement and,48.989,23.49,72.479,NA
learning so we believe that we can study brain regions across different species and understand fundamental principles about how brains work,59.969,19.332,79.301,NA
