text,start,duration,end,dominant_emotion
[Music] and I is for body mass index and it takes into account your height and your weight and determines the fat mass so the BMI chart or body mass index chart,0.21,27.91,28.12,sad
can help you get a good range of where you should be based on your height now it's different for everybody because some people are more muscular some people are more lean some people have,13.65,21.599000000000004,35.249,NA
more fat mass so there is a flexibility associated with it and if you're concerned about your weight you should always talk to your doctor because they can give you an idea of where you should,24.359,20.760999999999996,45.12,NA
be how much weight should you lose do you need to lose weight you want to keep track of your weight so that you know are you going up are you staying the same are you losing weight and you don't,35.19,20.91,56.099999999999994,NA
know why so weighing yourself as a relatively easy way to just keep track of how you're doing overall you,45.6,16.23,61.83,NA
