text,start,duration,end,dominant_emotion
diabetes may be present before pregnancy or may develop during pregnancy itself if you develop diabetes during pregnancy it will most likely be a specific type of diabetes known as gestational,1.01,25.659,26.669,angry
diabetes blood sugar levels are important for all mothers to being with diabetes as well controlled blood glucose levels can significantly improve the likelihood of having a healthy baby,13.2,24.439999999999998,37.64,angry
the NHS states that the target hba1c for mothers before and during pregnancy is forty-three millimoles per mole if you have diabetes before your pregnancy the NHS advises achieving the target hba1c,25.279,31.321,56.6,angry
before conceiving the target hba1c may require dedication to reach but it's important that you strive to achieve it you may find that regular blood glucose monitoring including before each meal,40.73,25.089000000000002,65.819,angry
and one hour after may help you to achieve good blood glucose levels if blood glucose levels are higher than recommended you may need to change your medication regime in order to help lower,54.449,23.581000000000003,78.03,angry
your blood glucose levels your health team should be able to provide you with advice on managing blood glucose levels throughout your pregnancy sometimes the emphasis on achieving,66.0,19.971,85.971,happy
tight blood glucose control may result in hypoglycemia particularly amongst those using insulin your health team should be able to ensure that you know how to spot and treat hypoglycemia,77.4,23.408,100.808,NA
