text,start,duration,end,dominant_emotion
"up dramatically over the last few years. While
starting close to 0% in 1999, it had gone",1498.07,12.26,1510.33,NA
"up to roughly 50% of cases by the year 2008,
2009. Concomitantly, the use of mannitol as",1510.33,11.67,1522.0,NA
"a solo therapy has gone down. The use of the
two together remains relatively infrequent.",1522.0,6.87,1528.87,NA
"Over that same time period, mortality in patients
with DKA has also gone down quite significantly,",1530.0,6.36,1536.36,NA
"from 0.47% in 2000, to a low of 0.8% in 2009.
This is a logistic regression, taking account",1536.37,11.27,1547.6399999999999,NA
"the effective discharge year, adjusted for
hospital clustering, and is statistically",1547.64,6.23,1553.8700000000001,NA
"significant. The odds ratio of mortality in
patients treated for DKA, when looked at,",1553.87,10.08,1563.9499999999998,NA
"mannitol versus hypertonic saline, is, in
fact, increased slightly with the use of hypertonic",1563.95,8.1,1572.05,NA
"saline alone to an adjusted odds ratio of
2.7, which is statistically significant even",1572.05,8.64,1580.69,NA
"after taking into account other significant
factors, such as male gender, use of mechanical",1580.69,6.57,1587.26,NA
"ventilation, and CT scanning.",1587.26,4.34,1591.6,NA
"This has allowed us to create some additional
thoughts that should be considered when treating",1591.6,10.01,1601.61,NA
"someone for DKA. It's noted that this is the
largest retrospective study that's ever been",1601.61,5.23,1606.84,NA
"conducted in DKA, and that, over the decade
it was studied, the rate of treatment for",1606.84,6.58,1613.4199999999998,NA
"cerebral edema has increased four-fold, while
the overall mortality in DKA has decreased",1613.42,4.88,1618.3000000000002,NA
"by 80%. However, this decrease was not associated
with the marked rise in use of 3% saline as",1618.3,8.82,1627.12,NA
"therapy. In fact, there is a slight increase
in mortality among those who receive 3% saline",1627.12,7.21,1634.33,NA
after conducting an adjusted analysis.,1634.33,3.49,1637.82,NA
"These data ought to be considered when choosing
a rescue therapy for a cerebral edema in DKA.",1637.82,5.2,1643.02,NA
"I thank you very much for listening, and look
forward to interacting with you online with",1643.02,7.0,1650.02,NA
any questions that develop. Thank you.,1650.02,3.35,1653.37,NA
"Please help us improve the content by providing
us with some feedback.",1654.1,4.29,1658.3899999999999,NA
