text,start,duration,end,dominant_emotion
"- Today, we're tackling
an age old question.",0.0,2.44,2.44,fear
"Do you have to count calories
in order to lose weight?",2.44,3.39,5.83,fear
The throat answer is no.,5.83,1.69,7.52,fear
And today I've got four easy,7.52,1.69,9.209999999999999,fear
"and practical alternatives
coming right up.",9.21,2.99,12.200000000000001,fear
"Hey, killer bees,",12.2,0.833,13.033,happy
"I'm Pahla B, your best
middle-aged fitness friend",13.033,2.187,15.219999999999999,fear
"and true confession time,",15.22,1.69,16.91,happy
I actually don't like to count calories.,16.91,2.54,19.45,happy
"And yet last year at age 50,",19.45,2.07,21.52,fear
"I was able to successfully
lose about eight pounds.",21.52,3.41,24.93,happy
So how did I do it?,24.93,1.7,26.63,happy
"And why do I normally recommend
that you count calories?",26.63,3.89,30.52,happy
"You guys, in my Five-Oh method,",30.52,1.73,32.25,fear
which I have here on screen,32.25,1.24,33.49,fear
"and in the description box below,",33.49,1.64,35.13,fear
I outline what I think of,35.13,1.72,36.85,surprise
"as the simplest way to lose weight,",36.85,2.06,38.910000000000004,sad
"eating the right number of
calories every single day,",38.91,2.31,41.22,sad
"drinking the right amount of water,",41.22,1.39,42.61,sad
"getting enough sleep,
exercising moderately,",42.61,2.3,44.91,fear
and managing your mindset.,44.91,1.83,46.739999999999995,fear
"So, yeah, I actually recommend
that you count calories",46.74,3.77,50.510000000000005,sad
"because it's incredibly simple,",50.51,1.98,52.489999999999995,sad
"the information is everywhere,",52.49,2.63,55.120000000000005,surprise
and it's really easy to calculate,55.12,2.14,57.26,fear
"because there are dozens,
probably hundreds, of apps",57.26,3.01,60.269999999999996,fear
that can help you with it.,60.27,1.47,61.74,fear
The only downside to counting calories,61.74,2.065,63.805,sad
"is that word, calories.",63.805,3.455,67.26,fear
"Sometimes, the thought
of counting calories",67.26,2.92,70.18,fear
is what can really trip us up.,70.18,1.92,72.10000000000001,happy
Let me tell you the four alternatives,72.1,2.27,74.36999999999999,happy
that you could try instead.,74.37,1.62,75.99000000000001,sad
"And while we're talking about it,",75.99,1.28,77.27,fear
"which one of these things
do you think I did?",77.27,2.37,79.64,neutral
"Alternative number one is
to count something else",79.64,2.33,81.97,fear
like macros or points.,81.97,2.17,84.14,fear
Now the pros on this one is that,84.14,1.36,85.5,fear
it's incredibly simple to do.,85.5,2.46,87.96,neutral
A five minute Google search will get you,87.96,2.14,90.1,neutral
everything you need to know,90.1,1.17,91.27,
"for just about every kind of
food you could possibly eat.",91.27,3.73,95.0,sad
"Now, the cons are that you're
actually still counting",95.0,3.2,98.2,neutral
"and probably still weighing and measuring,",98.2,2.56,100.76,
as though you were counting calories.,100.76,1.74,102.5,
"Alternative number two
is to eat the same foods",102.5,2.78,105.28,fear
in the same portions every single day.,105.28,2.58,107.86,sad
"Now the pros on this one
are that it's super simple,",107.86,3.18,111.04,fear
"you make a decision once
you'll never have to",111.04,2.38,113.42,sad
"figure something out on the fly,",113.42,1.35,114.77,sad
you always know what's coming next.,114.77,2.24,117.00999999999999,neutral
"The cons are that you're
eating the same foods",117.01,4.34,121.35000000000001,fear
"in the same portions, every single day.",121.35,2.89,124.24,fear
"Alternative number three is
to eat to your hunger cues.",124.24,3.46,127.69999999999999,fear
"The pros on this one is
that this is a beautiful,",127.7,3.02,130.72,sad
loving way to give your body,130.72,2.08,132.8,fear
"exactly what it needs, when it needs it.",132.8,3.44,136.24,fear
"The cons, however is that there's actually",136.24,2.21,138.45000000000002,sad
"a pretty sharp learning curve,",138.45,1.97,140.42,fear
and your hunger isn't infallible.,140.42,2.19,142.60999999999999,fear
And here's what I mean by that.,142.61,1.25,143.86,fear
There's actually both a physiological,143.86,2.12,145.98000000000002,fear
"and psychological
component to hunger cues.",145.98,3.18,149.16,fear
So if you have been eating at noon,149.16,1.8,150.96,fear
"every day for hundreds of years,",150.96,2.18,153.14000000000001,fear
"then your body is gonna send
you hunger signals at noon,",153.14,3.2,156.33999999999997,
"even if you just ate and don't
actually need the energy.",156.34,2.91,159.25,
"Or on the flip side of that,",159.25,1.33,160.58,
if you've actually been ignoring,160.58,1.89,162.47,
"your hunger cues for a hundred years,",162.47,2.65,165.12,
then your body might not even be producing,165.12,2.19,167.31,
those hunger signals anymore.,167.31,1.56,168.87,
"Alternative number four
is to use your hand",168.87,2.59,171.46,sad
to plan your meals.,171.46,1.1,172.56,fear
"Now I am not taking credit for this one,",172.56,1.56,174.12,fear
"I totally got this from a place
called Precision Nutrition.",174.12,2.82,176.94,fear
And I'll even hook you up with a link,176.94,1.52,178.46,fear
in the description box below,178.46,1.11,179.57000000000002,sad
so that you can see the work that they do.,179.57,1.76,181.32999999999998,neutral
"But here's what you do,",181.33,1.37,182.70000000000002,sad
"at every single meal you
have a palm of protein,",182.7,3.7,186.39999999999998,fear
"you have a fist of vegetables,",186.4,2.48,188.88,sad
"you have a cup tanned
of some grain or carb,",188.88,3.13,192.01,fear
and you have a whole thumb of fat.,192.01,2.69,194.7,sad
"Now the pros on this
one are pretty obvious.",194.7,1.51,196.20999999999998,happy
"You don't really have to
weigh or measure anything,",196.21,2.47,198.68,happy
"and the tool that you would
use to do such a thing",198.68,1.92,200.6,fear
is pretty handy.,200.6,2.83,203.43,
"The cons on this one though,",203.43,1.38,204.81,fear
"are what about casseroles, right?",204.81,3.66,208.47,fear
"It's totally easy if
you're eating in a plate",208.47,2.03,210.5,
"that has a chicken breast
and a scoop of vegetables",210.5,2.92,213.42,
"and rice with a little
bit of butter on it,",213.42,1.79,215.20999999999998,
"but real world foods can
get a little bit trickier.",215.21,3.96,219.17000000000002,fear
"Okay, yes, I'm gonna
tell you which one I did,",219.17,2.55,221.72,sad
"but first of all, let's talk
about these alternatives.",221.72,2.68,224.4,happy
"Did one of them sound
really appealing to you,",224.4,3.01,227.41,fear
or did they all still sound kind of tough?,227.41,3.79,231.2,sad
"The thing is, all of these alternatives",231.2,1.9,233.1,sad
still have something in common,233.1,1.32,234.42,sad
and that is that you need to pay attention,234.42,3.04,237.45999999999998,
to what you're eating.,237.46,1.61,239.07000000000002,
There is no way to sidestep the fact that,239.07,3.76,242.82999999999998,
"paying attention and counting
something is a mindset issue.",242.83,4.15,246.98000000000002,
"This is something that you
are going to need to tackle.",246.98,2.76,249.73999999999998,fear
"And I'm gonna ask you, why
does it feel tough to do that?",249.74,3.48,253.22,fear
And that's a real question.,253.22,1.11,254.33,fear
"I'm actually wholeheartedly
encouraging you",254.33,2.83,257.16,fear
"to get out your journal and ask yourself,",257.16,2.33,259.49,fear
why it feels difficult to count.,259.49,2.67,262.16,sad
"This is something that you're
going to need to figure out",262.16,3.31,265.47,fear
on your way to successful weight loss.,265.47,2.33,267.8,fear
"What do I do on my way to
successful weight loss?",267.8,3.27,271.07,fear
If you guessed that I ate the same things,271.07,1.92,272.99,sad
"in the same portions every single day,",272.99,2.22,275.21000000000004,fear
"you are absolutely correct, for reals.",275.21,2.2,277.40999999999997,fear
"You guys, I actually found this to be",277.41,1.78,279.19,neutral
incredibly simple and soothing.,279.19,3.43,282.62,fear
I knew exactly what I was gonna eat,282.62,2.05,284.67,fear
every single day for six months.,284.67,2.75,287.42,sad
And there was actually a lot more variety,287.42,1.84,289.26,sad
to it than you might think.,289.26,1.07,290.33,
"If you'd like to know exactly
what I ate every single day,",290.33,3.42,293.75,
"check out this video right here,",293.75,1.45,295.2,happy
and I'll see you over there.,295.2,1.4,296.59999999999997,happy
