text,start,duration,end,dominant_emotion
"Significantly improved from
our original Edmonton protocol data, where currently at 15
years, just 11% of patients remain insulin-free. I mentioned the hemoglobin
A1c-- the glycated hemoglobin-- this marker in the
bloodstream that tells you",1256.97,14.709999999999999,1271.68,NA
"how good the blood
sugar control is. And you can see at the
beginning where it says pre there, on the left hand
side of your screen, that the levels are
around 8% or 9%. And the red line
is the threshold",1271.68,11.04,1282.72,NA
"of what a normal
person would have, who doesn't have diabetes. Now as we bring the line closer
and closer to the red line, then the risk of getting
secondary complications is obviously reduced markedly.",1282.72,11.947000000000001,1294.667,NA
"But normally, if we did
that with injected insulin from the outside, the closer we
got to the red line, the more and more dangerous hypoglycemias
the patient would have. Well after the islet
cell transplant, we can achieve the
below the red line",1294.667,10.573,1305.24,NA
"or under the red
line very reliably without the risk
of hypoglycemia. And these graphs show you the
different measures that we use. Beforehand, you see
the patients have a sky-high risk of hypoglycemia,
and this score is about five",1305.24,12.540000000000001,1317.78,NA
"on that score. On the hypo score,
it's around 1,200. And afterward, you
can see it's almost undetectable over
the course of time. So patients are
completely protected,",1317.78,10.971,1328.751,NA
"as long as the cells
continue to function, from hypoglycemia and
swings in blood sugar. So this is a very
effective treatment for controlling blood sugar. [VIDEO PLAYBACK]",1328.751,8.615,1337.366,NA
"-I feel my control
now is the best it's ever been in 20 years. [END VIDEO PLAYBACK] DR. JAMES SHAPIRO:
What about the risk of the secondary complications?",1337.366,9.863999999999999,1347.23,NA
"There are several
centers looking at this. Garth Warnock Vancouver has
looked at this quite closely. What he finds in a control
group with islet transplant versus conventional, or best
medical care insulin therapy, is the islet transplant group
has much lower hemoglobin",1347.23,14.939999999999998,1362.17,NA
"A1c in the green. They have less risk
of eye disease. And their kidneys are
actually protected, despite the fact that they
are receiving tacrolimus. So this is very
encouraging data to suggest",1362.17,10.56,1372.73,NA
"that an islet or
other cell transplant, or stem cell transplant in
the future for diabetes, will have these
similar effects, being able to protect against
the secondary complications of diabetes.",1372.73,10.97,1383.7,NA
"We're working with the
US FDA quite closely in two major trials were part
of the clinical islet transplant consortium. One is called CIT-06 and
one is called CIT-07. And basically to
make it very simple,",1383.7,12.55,1396.25,NA
"one is islet after
kidney transplants, in the 07 one are islets alone. These trials are now
completed or undergoing a very detailed analysis with
the FDA, and very likely, these two trials will
lead to the FD awarding",1396.25,12.66,1408.91,NA
"a biological license for
islet transplantation, allowing Medicare, Medicaid,
and third party payers to potentially reimburse islet
transplant in the US, which has been a major limiting factor
in terms of the numbers of cell transplants done in the US.",1408.91,13.93,1422.8400000000001,NA
"We've been very fortunate
in Canada however to have the Canadian government
pay-- the Alberta government, I should say-- pay for
the Canadian transplants to this point. And a similar thing
has happened in the UK",1422.84,10.136000000000001,1432.9759999999999,NA
"with the National Institute
of Clinical Excellence paying for islet transplant
through the UK government. Same thing in Australia, same
thing in Europe, and Geneva, and in several other countries. So hopefully this will
happen very soon in the US.",1432.976,12.764,1445.74,NA
"Several groups have
reported the ability to achieve what I showed you
with two islet transplants with a single donor
islet infusion. And this would be
important because it would allow twice the
number of patients",1445.74,9.886000000000001,1455.626,NA
"to receive transplants from
a limited donor source, from organ donors. And so several centers
have been able to do that with different strategies. But still this is a challenge,
I would say, for us.",1455.626,11.314000000000002,1466.94,NA
"Only about 10% of our
patients in Edmonton are able to achieve insulin
independence routinely. If we don't select the donor,
we don't select the recipient entirely. What we do find if we look
at Melena Bellin's analysis?",1466.94,13.7,1480.64,NA
"Looking at all the
patients treated that are participating in these
centers, that at five years, if we give an anti-inflammatory
treatment at the beginning called Tanacet-- which prevents
an inflammatory agent called TNF-- if we switch that
off at the beginning,",1480.64,16.01,1496.65,NA
"we can have many, many
more patients of insulin at five years. Seems to be very important
to suppress inflammation at the beginning. So we've done studies in mice.",1496.65,8.07,1504.72,NA
"We always take things back
to mice and test things. And we tested another compound
called Anakinra, which is another antibody--
which is also an anti-inflammatory one used
in inflammatory bowel disease and another condition
called psoriasis--",1504.72,12.11,1516.83,NA
"and we found that this is
a very effective treatment to allow human islets
to engraft in mice. And we've been able to take that
treatment across to the clinic and treat many
patients that way. We've also been trying to
switch off the cell death",1516.83,12.07,1528.8999999999999,NA
"pathways in this pathway
called apoptosis. So cells die by
different processes, but we've tried several agents
to switch off cell death. These are called pan
caspase inhibitors, because they switch off
all the major cell death",1528.9,12.130000000000003,1541.0300000000002,NA
"pathways that lead
to this apoptosis. And when we've tested these in
our mouse models and our pig models, we find that
these caspase inhibitors can reduce the tiny
number of islets needed to reverse diabetes
by about 80%.",1541.03,13.639999999999999,1554.67,NA
"So they make a big,
big difference. And we've tested
this several times in various different
combinations and various different ways. And we've moved on and carried
out the early clinical trial",1554.67,9.489999999999998,1564.16,NA
"with these that looks--
well at this point, it's difficult to say whether
it's had a big impact. But we're still working on it. So we recognize today that
islet transplantation, the way it is today,
because patients",1564.16,10.440000000000001,1574.6000000000001,NA
"need immunosuppression, because
there is a shortage of organ donors, could only
really address a very narrow band in
the spectrum of patients with diabetes. And we'd like to get
to this point here",1574.6,9.39,1583.99,NA
"where we can treat all
the patients that are just diagnosed with diabetes, that
have difficult to control diabetes, that have
chronic type I diabetes, and also those that
have type 2 diabetes-- the entire spectrum of diabetes.",1583.99,12.420000000000002,1596.41,NA
"And we recognize
that if we keep going the way we are going
on that one track, we won't be able to address
that entire spectrum. So what next? So we're looking at
alternative retrievable sites",1596.41,9.69,1606.1000000000001,NA
"to put in islets today, or stem
cells potentially tomorrow. And here's a trial
that we're actively involved in now with a
company called Sernova. And this is a device
that goes under the skin. It's the the size and
shape of a tea bag.",1608.81,13.548999999999998,1622.359,NA
"And it basically threads
in under the skin. We leave it there for
about a month or two. And while it's
under the skin here, the body makes new blood
vessels that grow in. And this is a sort of in
response to a foreign body.",1622.359,12.861,1635.22,NA
"Then we take those rods
out when we come back. And we can do this under
a local anesthetic, we can do this under
a general anesthetic. And then we can infuse
ourselves along that track, and basically put the cells
in under the skin instead",1635.22,11.51,1646.73,NA
"of in in liver. Now that may be an advantage,
but as we think to the future, as we think about
use of stem cells, it might be safer to put
them in a retrievable place where we can take them
out if we need to.",1646.73,11.069999999999999,1657.8,NA
"So if we put them under the
skin instead of the liver, it's a much simpler maneuver
to take the cells out. So we've done this so
far in a few patients, and it's looked
somewhat promising in terms of being able
to show cell survival.",1657.8,12.08,1669.8799999999999,NA
"But this is still ongoing,
and we're looking at the data closely. We've also been looking at what
we call the deviceless method. So we put a tube under the skin. We leave the tube under the
skin-- a simple catheter",1669.88,14.09,1683.97,NA
"that we use routinely
in the x-ray department. We leave that catheter
under the skin for a month. We take the calculator out,
and then we put our cells, or stem cells, or
islets, or whatever kind of cell population
we want to put in,",1683.97,10.795,1694.765,NA
"in this track, which has now got
lots of nice new blood vessels. And here you can
see islets surviving in that round area
that used to have the little catheter
on the top left there. And the cells work very well.",1694.765,10.825000000000001,1705.5900000000001,NA
"And you can see with the
catheter placed under the skin, and then we put the
cells in the blue line, blood glucose comes
down quite nicely, It takes a few weeks to do so. And you can see on
the right, we get",1705.59,10.53,1716.12,NA
"lots of nice new blood
vessels growing in to supply these cells. So I mentioned islet transplants
today, and stem cells tomorrow. So I think we are
getting very close now to being able to move
forward with stem cell",1716.12,12.739999999999998,1728.86,NA
"treatments instead of islet
cell transplant treatments for the next round of
trials for the future. There are several
groups across the world working on stem cells. And I'll show first
just one that we're",1728.86,10.879999999999999,1739.74,NA
"collaborating with,
Maria Nostro and Gordon Keller at the
University of Toronto have made a stem
cell line that makes human insulin-- the human beta
cells, basically-- from stem cells.",1739.74,10.576000000000002,1750.316,NA
"And we've been able to reverse
diabetes quite effectively in mice and our deviceless
model with that cell system. We've also been testing out
to see if the cells turn out to have what's
called a teratoma, or risk of awry cells, then
they can be transplanted still",1750.316,15.994,1766.31,NA
"in this deviceless space
and not breach the space, so we can still
potentially remove them. We've also been working
for the last 10 years with a company called
Viacyte down in San Diego. And we've been very
excited by that progress",1766.31,12.78,1779.09,NA
"in developing a human embryonic
stem cell line that they have shown can reliably
make human insulin, and can be potentially
transplanted, and can cure diabetes in
mice when transplanted. And this group has
been very innovative",1779.09,17.73,1796.82,NA
"and shown these
cells to be safe, to have no risk of the
teratoma that I mentioned. And they are now carrying
out a clinical trial that we're looking
forward to participate in, where we're going to put
these cells inside what's",1796.82,12.36,1809.1799999999998,NA
"called an immunoisolating
device, so that the immune
system can't directly get cell-to-cell contact
with the transplanted cells. And the idea of that
is that we wouldn't have to give the
anti-rejection drug treatments",1809.18,10.98,1820.16,NA
"if it's effective. So we're looking forward
to starting these trials with Viacyte within
the next few months. Now in parallel, there's
lots of other treatments that could
potentially switch off",1820.16,11.390000000000002,1831.5500000000002,NA
"the autoimmune pathways
in type 1 diabetes. And Jeff Bluestone,
from San Francisco here, has summarized all
the different pathways that can be switched off in type
1 diabetes, all the studies, all the antibodies, all
the drug treatments that",1831.55,14.15,1845.7,NA
"can be given to try
and control diabetes. And it's obviously
a very complex one. We've amassed a team in
Alberta to try and address one or two of these
together with industry and a large collaboration
of scientists",1845.7,11.719999999999999,1857.42,NA
"in Edmonton and Calgary. We're going to do
two different trials. One is trying to get
patients' own stem cells to regenerate
their own pancreas as soon as the patient is
diagnosed with diabetes.",1857.42,10.155000000000001,1867.575,NA
"In other words, resetting
the immune system and getting the
patient's own cells to turn back and
repair the beta cells. And then the second
strategy we're using is the Viacyte cell transplants
to try to treat patients",1867.575,16.035,1883.6100000000001,NA
"just like we would at the
Edmonton protocol type treatments that I
showed you about. So the immune reset
is moving forward. We've got our plans in place. We're just putting
them through ethics",1883.61,9.802999999999999,1893.413,NA
"and through Health
Canada right now. We're going to give antibody
treatments at the beginning to reset the immune system. We're going to take the
patient's own bone marrow cells and re-transplant those
up into the pancreas",1893.413,10.617,1904.03,NA
"to allow those cells to
repair the injured pancreas. Then we're going to give a
treatment for the first year, called a GLP-1 analog,
that will help to further regenerate and
accelerate the growth and repair of injured islets.",1904.03,12.686,1916.716,NA
"So we have a lot
of things to do, and we're very, very
excited about it. We're also working
with another technology called normothermic perfusion. And this is going
to I think really",1916.716,10.043999999999999,1926.76,NA
"revolutionize all areas
of transplantation. So most the time you can see
those boxes on the right, that's how we carry
organs around, in ice. So hearts, lungs,
livers, kidneys, and the pancreas
for our islets--",1926.76,10.84,1937.6,NA
"we carry them in these boxes. So we're just about
to start a trial with a group at the
University of Oxford, and a company called
OrganOx, where they have one device that
we could put a liver on,",1937.6,12.04,1949.6399999999999,NA
"which is in this
bottom left panel. There's other companies that
have a device for hearts, for lungs. And here's one that
we're testing out for pancreas transplantation.",1949.64,9.98,1959.6200000000001,NA
"So in other words, instead
of putting the organ in ice and having it
injured, we can keep it perfectly alive--
like the heart's beating there-- outside the body. And so as soon as
we transplant it,",1959.62,9.942,1969.562,NA
"it can be in perfect
condition when we transplant these organs. It'll make a big, big difference
to the safety of transplants, and also to make sure that
the transplants really work before we put them in.",1969.562,10.243,1979.8049999999998,NA
"And the idea here is that we
can deliver oxygen, deliver nutrients, provide a
physiological temperature, and provide an ideal
environment for the organ while it's outside of the body. So we're very excited about this
technology as well as we move",1982.6,12.459999999999999,1995.06,NA
"forward. And this is the liver machine
that we're about to test. And the company who
came to San Diego to the World Transplant
Congress mentioned to me that they'd love
to have Google's",1995.06,10.14,2005.2,NA
"logo on the outside of the box. So, if you're interested
in working with them, just let them know. So let me sum up. So I showed you that we've
made a lot of progress",2005.2,8.360000000000001,2013.56,NA
"in the treatments of diabetes
over the course of time. That insulin dependence
rates have improved a lot. That several centers now have
over half of their patients still free of
insulin at five years after an islet transplant.",2013.56,12.04,2025.6,NA
"That we're looking now to
other alternative sites for infusing islets
under the skin. I didn't mention
other sites that we're about to test with
the Pittsburgh group, including the lining
of the stomach.",2025.6,10.82,2036.4199999999998,NA
"We're about to start trials with
Viacyte on their embryonic stem cell treatments. And we're also looking
at regeneration trials to regenerate and repair
the pancreas and the islets that at the moment a child or
adult is diagnosed with type 1",2036.42,13.38,2049.8,NA
"diabetes. So there's a lot of
things happening. I think we'll make
a lot of progress. So finally today, I'm very much
looking forward to discussing with the contact lens team
our opportunities of working",2049.8,10.030000000000001,2059.8300000000004,NA
"together in cell
transplant monitoring, and also with the
Google Glass team, looking at the role
of the Google Glasses and state-of-the-art monitoring
and complex surgeries. A guy was telling
me about the use",2059.83,12.49,2072.3199999999997,NA
"of these in lung
transplantation. I think we could apply this
very easily also in liver transplantation, maybe join
the pancreas islet isolation. I think also this could
allow us to communicate far better as scientists from
one institution to another.",2072.32,14.03,2086.3500000000004,NA
"So instead of me being in
Edmonton, another group being in San Francisco,
another group being in Australia, another
group being in China, we could make a
scientific community that is basically global
and one, and allow",2086.35,11.48,2097.83,NA
"us to work much closer together. And that's what I'm
very excited about. So on behalf of our
pre-clinical team scientists that have done all the
hard work-- our PhDs, our master students,
our post-docs,",2097.83,11.049,2108.879,NA
"and technicians that
have done really all the hard work and
pre-clinical testing-- on behalf of our
large clinical team that has basically helped up
prepare the islet transplants. So thank you very much
indeed for the opportunity",2108.879,10.941,2119.8199999999997,NA
"to present to you
this afternoon. I look forward to
answering your questions. [APPLAUSE] AUDIENCE: My name is Zerga. I actually work on
the iris and basically",2119.82,15.069999999999999,2134.8900000000003,NA
"the contact lens project here. So I've heard some questions
about the cells you infuse. So can you tell us some very
basic biology of those cells? So when you inject it into the
blood vessels of the kidney, where do they end up?",2134.89,15.150000000000002,2150.04,NA
"So do they actually stay
there and live in the kidney? Or do they end up
in the pancreas? DR. JAMES SHAPIRO:
So the question is-- so we transplant our
cells inside the liver. So it's a local injection
literally inside like this,",2150.04,14.74,2164.7799999999997,NA
"under x-ray. And we get the radiologist
to put a catheter into the main vein that
goes up into the liver. It's called the portal vein. And it's like a tree.",2164.78,8.983,2173.7630000000004,neutral
"It has main trunks, and
it has little branches. And the islet cells, the
vary in size, from about 50 microns to 150
micrometers in size. Some are larger-- 400 or
500 micrometers in size. And basically they
go up this tree,",2173.763,13.777,2187.54,neutral
"and they go far along
the tree until they get into a blood vessel
that's smaller than they are. There they get trapped. And basically a little bit of
blood clot forms around them, and a local inflammatory
reaction-- then new blood",2187.54,13.59,2201.13,fear
"vessels grow in
inside the liver. These cells are not going
back into the pancreas. We could potentially put
them in the pancreas, but it would be very, very
technically difficult to do so. It would be risky.",2201.13,11.61,2212.7400000000002,NA
"It could case pancreatitis. It could be a difficult
place to put them. It just so happens that the
liver is a very effective place to put these cells. AUDIENCE: [INAUDIBLE]",2212.74,8.34,2221.08,neutral
"DR. JAMES SHAPIRO: Potentially
they can grow anywhere. The question will be will
the cells work as effectively in another site as they
do currently in the liver. And we don't know that yet. AUDIENCE: How do they
communicate with the body?",2225.22,13.45,2238.6699999999996,NA
"When do they know
when to generate-- DR. JAMES SHAPIRO: How do
they communicate with the body was the question. So the islets have
sensors on them. So they have glucose
receptors and they",2238.67,10.6,2249.27,NA
"can sense the blood
sugar, much the same way you do with a skin test when
you take a drop of blood. They're listening to the
blood stream, monitoring it constantly, all the time. And as soon as the blood glucose
goes high, then in concert,",2249.27,13.620000000000001,2262.89,angry
"they all release just the
right amount of insulin that's needed in a
very dynamic way. And as the blood sugar drops
below a certain threshold, they all shut off, so
they stop making insulin. So it's a much more precise
way of regulating blood sugar",2262.89,18.955000000000002,2281.845,neutral
"than if you inject
insulin from the outside. So it's able to do
that because they're a collection of cells
there that adjust insulin. And i didn't mention, the islets
have several cell populations int them.",2281.845,12.254999999999999,2294.1,neutral
"The have the beta cells
that make insulin. They also have another
cell population called alpha cells
that make glucagon. And glucagon makes
the blood sugar go up. So you have what's called
counter regulatory control.",2294.1,11.15,2305.25,angry
"So with counter
regulatory control, you can keep your blood sugar
in a very precise balance. AUDIENCE: Hey, Dr. Shapiro. My name's Joel. My wife has lived with type 1
diabetes for nearly 40 years.",2305.25,11.98,2317.23,NA
"And she had a couple questions. The short one is-- do you
transplant the entirety of the islet, or
just the beta cells? And the more interesting,
or more complex question is-- are you
modifying the islet cells prior",2317.23,14.479999999999999,2331.71,NA
"to transplant to reduce the
chance they'll be attacked by the same antibodies
that originally killed of the islet cells? DR. JAMES SHAPIRO: So the
islets that we transplant are the collection
of all the cells.",2331.71,11.114,2342.824,NA
"So there's five-- I mentioned
two cell types-- there are actually five or six
different cell types. Maybe there's even more that
we haven't discovered yet. But the islet is sort of
an organelle collection of several types.",2342.824,9.536,2352.36,NA
"We think that the islet
needs all of those cell types in order to survive
in the longer term. If you just took out
all the beta cells and transplanted them, they
might work for a while. But maybe the beta
cells on their own,",2352.36,10.333,2362.693,neutral
"without the rest of
the supported matrix and the ability to communicate
with each other in this sort of local mode, maybe they
wouldn't work as well. We don't know that. But we transplant
all of the cells.",2362.693,9.687000000000001,2372.38,neutral
"And so the second question was-- AUDIENCE: Do you do anything
to modify the islet cells prior to transplant? DR. JAMES SHAPIRO:
Do we do anything. And so, the islets are
taken out of the pancreas",2372.38,10.344,2382.724,neutral
"in that process. We keep them in culture. Now in the old days, in the very
first experiments we've done, there was a lot of different
innovations that we had done. You could treat them
with ultraviolet light.",2382.724,11.645999999999999,2394.3700000000003,neutral
"You could treat
them with x-rays. You could treat them
with high oxygen. And these would alter what
is called the immunogenicity, or the ability of the body
to recognize them as foreign. We haven't done so
much of that now.",2394.37,10.7,2405.0699999999997,neutral
"But potentially you
can do a lot of things to manipulate the
cells in the Petri dish that could alter the
ability of the body to recognize them as foreign. we could wrap them in
a seaweed membrane,",2405.07,10.465000000000002,2415.5350000000003,neutral
"an algenate microcapsule. We could add other
products locally around the islets
to protect them. So an islet in some way
has a lot more potential than the other
transplants that we do,",2415.535,12.565,2428.1,neutral
"where we don't have that ability
to alter them in the dish. But we haven't explored that
perhaps to its full potential. Yeah, you're quite correct. AUDIENCE: I noticed
in one of the slides that the A1c's
that were reported,",2428.1,13.920000000000002,2442.02,NA
"or that were monitored in your
patients, seemed to improve over time after the
transplant, not just initially. And given the propensity
of these cells to degrade, I was surprised that it
got better as time went on. DR. JAMES SHAPIRO: I think
that's partly a function-- well",2442.02,15.585,2457.605,NA
"I should say hemoglobin
doesn't drop immediately. The reason for that is it
takes two or three months to have an effect. So if you have bad
control, then you suddenly go to perfect control,
the next A1c test",2457.605,12.294,2469.899,neutral
"is reflecting what happened
three months earlier. So there's a lag in
its ability to measure. It's designed that
way, because it is meant to tell
you what's happened over the last few months.",2469.899,9.911,2479.81,neutral
"So that's why you're
seeing a delay. It's not so much that control
is improving over time, but I think it's more that. AUDIENCE: And just sort of
a more general follow up. I've been diabetic for 25 years.",2479.81,12.85,2492.66,NA
